game_number,result,your_color,opponent_type,opponent_elo,move_count,moves
5,win,white,stockfish_level_1,N/A,49,Nc3 Nf6 e4 d5 Bb5+ Bd7 Nxd5 Bxb5 Nxf6+ gxf6 Qh5 Ba6 Nf3 Nc6 Qc5 e6 Qc3 Rg8 Rg1 Bb4 Qb3 Ba5 Qa4 e5 Rh1 Bb6 Rg1 Qd7 Rh1 Rg4 Rg1 f5 Nxe5 Qd6 Nxg4 h5 e5 Qc5 Nf6+ Kd8 d4 Ba5+ Kd1 Be2+ Kxe2 Nxd4+ Kf1 Nxc2 Qe8#
8,loss,black,stockfish_level_1,N/A,67,d4 Nf6 c4 e5 e3 Bb4+ Bd2 Bxd2+ Qxd2 Ne4 Qe2 Nc6 Qc2 Qh4 Nf3 Qg4 d5 Nb4 Qc1 Qf5 Nbd2 Nd6 c5 Nc2+ Kd1 Nxa1 cxd6 Nc2 dxc7 Kf8 Nc4 Qe4 d6 Rg8 Ng5 Qf5 h4 Rh8 Qxc2 Qg4+ Ke1 Kg8 a3 f6 Qb3 fxg5 hxg5 Qe6 Rh5 Qf7 Rh4 Qd5 Bd3 e4 Rxe4 Qf7 Qb5 a6 Qe5 Ra7 Qd4 Ra8 Re7 Qf8 Qd5+ Qf7 Re8#
2,loss,black,stockfish_level_1,N/A,95,e3 Nc6 Nc3 Nf6 Be2 Nb4 a3 Nbd5 Na2 Ne4 c4 Ndf6 Nf3 e6 d3 Nc5 b4 Na6 e4 Bd6 O-O Kf8 c5 Be7 Bf4 Nh5 Be5 f6 Bd4 Nf4 Nc3 Rg8 e5 fxe5 Nxe5 Bf6 Bf3 Qe7 Re1 Rh8 Ne4 Nxg2 Bxg2 Nxc5 Bxc5 d6 f4 dxc5 bxc5 Bxe5 fxe5 Kg8 Rc1 Qh4 Rf1 Bd7 Qe2 Bc6 Rc4 Bd5 Rc2 Bb3 Rc3 Bd5 Rc2 Bb3 Rc3 Bd5 Rcc1 Rd8 Kh1 Rd7 c6 bxc6 Rb1 Qd8 Qg4 h6 Qg6 Rh7 a4 Kh8 h3 Re7 Qg3 Qe8 Rbc1 Qd8 Qe3 Qb8 Qf4 Qe8 Qf8+ Qxf8 Rxf8#
6,loss,black,stockfish_level_1,N/A,93,e3 e5 d4 Nf6 dxe5 Ne4 Nd2 Bb4 c3 Bxc3 bxc3 Nxc3 Qc2 Nd5 Ngf3 Nc6 Ba3 Rb8 Qb3 Nb6 Rb1 Rg8 Rc1 Rh8 Be2 Rg8 h3 Rh8 O-O Rg8 g4 Rh8 Rfd1 Rg8 Ne4 Rh8 Kf1 Rg8 Qc2 Rh8 Ng3 Ra8 h4 Rb8 Kg2 Ra8 Kh2 Rb8 h5 Ra8 Rd2 Rb8 h6 gxh6 Qb2 Rg8 Bd3 Rxg4 Be2 Na4 Qa1 Nb6 Qb1 Ra4 Qb2 Ra5 Nh5 d6 Ng7+ Kf8 Rg1 Qe7 Rxd6 cxd6 Nf5 Bxf5 Bxd6 Qxd6 exd6 Ne5 Nh4 Be4 f4 Na4 Qd4 Bd3 fxe5 Bxe2 Qf4 h5 Qf6 Rxe5 Qh8#
4,loss,black,stockfish_level_1,N/A,117,e3 Nf6 c4 Nc6 Nf3 Ne4 d4 Rg8 Bd3 Nf6 e4 Nb4 Be3 Ng4 Bf4 e5 h3 exf4 e5 Nxf2 Kxf2 Rh8 Re1 Qe7 Nc3 Nxd3+ Qxd3 Qb4 Re2 Be7 Nd5 Qa5 b4 Bxb4 c5 Kf8 a3 Bxa3 Rxa3 Qxa3 Qxa3 d6 exd6 cxd6 Kg1 Be6 Rb2 Bxd5 c6 Kg8 Rxb7 Bxc6 Re7 Kf8 Re2 Kg8 Re1 Bd5 h4 Rf8 Qxd6 Ba8 Qc5 Rd8 Qe7 Rf8 h5 Bd5 Ra1 Rc8 Qe5 Rd8 Rb1 f6 Qf5 g6 Qxf6 Rf8 Qa6 gxh5 Ra1 Re8 Qa4 Re7 Qd1 Kf8 Ne5 f3 Qd2 fxg2 Qb4 Rg8 Qd6 Rg5 Rc1 Be6 Nc6 Rg7 Rc2 Bf5 Ra2 Be6 Re2 Bc4 Qd8+ Kf7 Rf2+ Kg6 Nxe7+ Kh6 Nf5+ Kg6 Qd6+ Kf7 Qe7+ Kg8 Qe8#
10,loss,black,stockfish_level_1,N/A,61,c4 Nf6 Nf3 Nc6 a3 Ne4 e3 Rg8 Be2 Rh8 O-O Rg8 Qc2 f5 d3 Nc5 b4 Ne6 d4 g6 d5 Bg7 Nc3 Nxb4 axb4 Nf8 Ra3 c6 Rd1 Qc7 Bb2 Qd6 Qb3 cxd5 Nxd5 Bxb2 c5 Qe6 Qxb2 Qc6 h4 Ne6 Qa1 Rg7 Ne5 Qxd5 Rxd5 Kf8 Ra2 Kg8 Rd1 Kf8 Rad2 Ke8 c6 dxc6 Qb2 Kf8 Rd8+ Nxd8 Rxd8#
1,loss,white,stockfish_level_1,N/A,168,Nf3 c5 Nc3 e6 Ne5 Ne7 Ne4 Ng6 Nxg6 hxg6 e3 d5 Bb5+ Bd7 Bxd7+ Nxd7 Nc3 Qh4 Qf3 Bd6 Nb5 Ke7 g3 Qh5 Qxh5 Rxh5 g4 Rh3 Nc3 Rah8 Kf1 g5 Kg2 b6 Kg1 R8h4 Kg2 Ne5 Nb5 Nxg4 Nxa7 Rxh2+ Rxh2 Bxh2 Nc8+ Ke8 Nxb6 Bc7 Nc8 f5 Kg1 Rh8 Rb1 Kd8 Na7 Nh2 Nc6+ Kc8 Ne7+ Kd7 Ng6 Rh3 Nf8+ Kc8 Kg2 Rh6 Ra1 Ng4 Kg1 Ne5 Kg2 g4 Rb1 Bd6 d4 Nc4 e4 f4 b3 Nb6 dxc5 f3+ Kg1 Bh2+ Kf1 g5 Bxg5 Rh3 cxb6 g3 Nxe6 g2+ Ke1 g1=Q+ Kd2 Bf4+ Nxf4 Qxg5 b7+ Kb8 Ke3 dxe4 Kxe4 Rh6 Kxf3 Rf6 Rb2 Qxf4+ Kg2 Qxf2+ Kh3 Rf3+ Kg4 Qg3+ Kh5 Qh2+ Kg4 Rg3+ Kf5 Qh8 Kf4 Rg7 Kf5 Rc7 Rb1 Qf8+ Kg6 Qe7 Rb2 Qh4 Kf5 Qh6 Ke5 Qh8+ Ke6 Rxb7 Rb1 Qh7 Rb2 Qh6+ Kf5 Rb5+ Kg4 Rg5+ Kf4 Rg7+ Kf5 Rg5+ Kf4 Rc5+ Kg4 Qe6+ Kg3 Rc3+ Kh4 Qe1+ Kg5 Qc1+ Kg6 Rc6+ Kh7 Qh1+ Kg8 Qg1+ Kh7 Qg6+ Kh8 Rc8#
12,win,black,stockfish_level_1,N/A,36,e4 e5 Be2 Nc6 Bc4 Nf6 Qe2 Nd4 Qd3 Bb4 Nc3 Kf8 Nf3 Nxf3+ Qxf3 d5 exd5 Bg4 Qd3 e4 Qg3 Qd7 a3 Nh5 Qh4 Be7 Qxe7+ Qxe7 Bb5 Qc5 Nxe4 Qxb5 f3 Nf4 g3 Qe2#
7,loss,white,stockfish_level_1,N/A,166,Nf3 e6 Nc3 d5 Ne5 f6 Nf3 Nc6 Nb5 e5 Rg1 e4 Nh4 a6 Nc3 Bc5 Rh1 Nh6 d4 Ba7 Bxh6 gxh6 Qd2 f5 Qxh6 Rf8 O-O-O Ne7 Qg7 Be6 Rd2 Qd6 Rg1 O-O-O Qh6 Rf7 Rh1 c5 dxc5 Qc6 Rg1 Bxc5 Rh1 Ng8 Qg5 Bxf2 Nxf5 Bxf5 Qh5 e3 Rd4 Rff8 Qg5 Be6 Nxd5 Rfe8 Nb4 Rxd4 Nxc6 Rd5 Na7+ Kd7 Qg7+ Re7 Qf8 Re8 Qf3 Ra8 Qe4 Nf6 Qc4 Rxa7 Qb3 Rd1+ Kxd1 Bxb3 cxb3 Ke7 Kc2 Ra8 Kb1 Rd8 Kc2 b5 Kb1 b4 Kc2 a5 Kb1 Rd1+ Kc2 Rd2+ Kb1 Rd4 Kc2 h5 Kb1 Rd1+ Kc2 Re1 Kd3 Nd5 Kc4 Nf6 Kb5 Ne4 Kxa5 Ra1 Kxb4 h4 Ka3 Kd6 b4 Rb1 Kb3 Kd5 Kc2 Ra1 Kb3 Rd1 Ka4 Be1 Kb5 Bd2 Rg1 Ke5 Ka5 Kd4 Kb5 Rc1 Ka5 Kc4 b3+ Kc3 Kb5 Rd1 Ka5 Rc1 Kb5 Rd1 Ka5 Kb2 g3 Bc3 gxh4 Ra1 a4 Nd2 Kb6 Kxb3 Kc7 Kxa4 Kb8 Rd1 b5 Ka5 Rh1 Nxf1 Kc8 Kb6 Rg1 Be5 Rh1 Bf6 Rxf1 Rd8#
3,win,white,stockfish_level_1,N/A,183,d4 d5 Nf3 Nf6 Bg5 Ne4 Bh4 f6 Qd3 Nc6 Qb5 e5 Nxe5 Nd6 Qa4 a5 Nc3 Nf5 Nxc6 bxc6 Qxc6+ Bd7 Qxd5 g5 Qe4+ Kf7 Qd5+ Kg6 Bxg5 c6 Bxf6 cxd5 Bxd8 Nxd4 O-O-O Nxe2+ Bxe2 Bf5 Rxd5 Bg7 Bxa5 Bxc3 Bxc3 Rxa2 Rd6+ Be6 Rxe6+ Kf7 Bxh8 Ra1+ Kd2 Rd1+ Kxd1 Kxe6 Bd3 h5 Bg6 Kd6 Bxh5 Kc7 Bf6 Kd7 Bg6 Ke6 Bd4 Kd7 Bf5+ Kd8 Bb6+ Ke8 Bc5 Kf7 Be4 Ke6 Bb6 Kf7 Bc5 Kf6 Bd6 Ke6 Bc5 Kf7 Bd6 Kg8 Be5 Kf7 Bd6 Kf6 Bc5 Kg7 Bd6 Kh8 Be5+ Kg8 Bf6 Kf7 Be5 Kf8 Bd5 Ke8 Bd6 Kd8 Be6 Ke8 Bd5 Kd7 Be5 Kc8 Bd6 Kd7 Be5 Ke7 Bg7 Ke8 Kc1 Kd7 Re1 Kc8 Be5 Kd7 Bb7 Kd8 Re2 Kd7 Kb1 Ke6 Bc6 Kf7 Bd5+ Kg6 Bd6 Kg7 Be5+ Kh6 Bf6 Kh5 Be6 Kh6 Be5 Kh7 Bf5+ Kg8 Bg6 Kf8 Bh8 Kg8 Bf6 Kf8 Bh8 Kg8 Bf6 Kf8 Bh8 Kg8 Bf6 Kf8 Bh8 Kg8 Bf6 Kf8 Bd4 Kg8 Bc3 Kf8 Bf6 Kg8 Bd4 Kf8 Bf6 Kg8 Bd4 Kf8 Bf6 Kg8 Bd4 Kf8 Bf6 Kg8 Bd4 Kf8 Bc3 Kg8 Re8#
13,loss,white,stockfish_level_1,N/A,68,d4 Nf6 e4 e6 Qf3 d6 Bb5+ Bd7 Bd3 e5 dxe5 Bg4 Bb5+ Nbd7 Bxd7+ Kxd7 Qf4 dxe5 Qd2+ Kc8 Nf3 Bc5 Nxe5 Bxf2+ Kxf2 Nxe4+ Kg1 Nxd2 Nxd2 Re8 Nxg4 a5 Nc4 Re1+ Kf2 Re6 Kg3 b5 Nce5 Raa6 Nxf7 Qe7 Nfe5 Qd6 Kh4 Rxe5 Nxe5 g5+ Bxg5 Qxe5 Bc1 Qe4+ Kh5 Qe8+ Kh4 Rg6 Bg5 Qe5 Bd2 Rxg2 Bxa5 Qe4+ Kh5 Qe5+ Kh6 Qg7+ Kh5 Qg5#
16,loss,black,stockfish_level_1,N/A,45,e3 Nf6 d4 d5 Nf3 Nc6 Bd3 Bg4 Nbd2 h6 c3 Qd6 O-O O-O-O c4 dxc4 Be2 c3 bxc3 Rd7 Nc4 Qe6 Qa4 Bxf3 Bxf3 Nxd4 exd4 Qf5 Ne5 Rd8 h3 Rh7 Qxa7 c6 Be3 Re8 Rab1 b6 Qa6+ Kb8 Qxb6+ Kc8 Qb7+ Kd8 Nxc6#
17,loss,white,stockfish_level_1,N/A,56,Nc3 e5 e4 Nc6 Bb5 Nf6 Qf3 a6 Bxc6 dxc6 Nge2 Bd6 Qd3 Qe7 Qf3 Be6 Kf1 h6 Rg1 h5 Rh1 h4 Rg1 h3 gxh3 g6 Rg2 O-O-O Qd3 Nd7 Ng3 Rxh3 Kg1 Rdh8 Kh1 Qh4 Rb1 f5 exf5 Nc5 Qe3 gxf5 Ra1 f4 Nf5 Bxf5 Qe2 Nd3 cxd3 f3 Rg8+ Kd7 Rxh8 Rxh2+ Kg1 Rh1#
14,win,black,stockfish_level_1,N/A,70,e3 d5 Nf3 e5 d3 Bg4 Be2 Bb4+ Nfd2 Bxe2 Qxe2 Nf6 e4 dxe4 h3 Nc6 O-O exd3 Qd1 dxc2 Qxc2 Qd5 Nf3 Kf8 a3 Bd6 Nc3 Qc4 Be3 Nd5 Ng5 Nxe3 Nxh7+ Rxh7 Qxh7 Nxf1 Qh8+ Ke7 Qxa8 Nd2 Qxb7 Nb3 Re1 Nba5 Qb5 Qd4 h4 Qd2 Rf1 a6 Qa4 Qd3 Rc1 Qd2 Rd1 Qxb2 Nd5+ Kf8 Qg4 Nd8 Qh5 Kg8 Nxc7 Bxc7 Rd7 Bb6 Kh1 Qxf2 Re7 Qg1#
15,loss,white,stockfish_level_1,N/A,98,e4 d5 Nf3 dxe4 Bb5+ Bd7 Nc3 exf3 Qxf3 Nc6 Nd5 Nf6 Nxf6+ gxf6 Qd5 h5 Bxc6 bxc6 Qd4 a5 Kf1 h4 Qd3 a4 Qd4 e5 Qd3 c5 Rg1 f5 Rh1 Qb8 Qc4 Bb5 Qxb5+ Qxb5+ Kg1 Qb6 Kf1 Qb5+ Kg1 Qb6 Kf1 Qb8 Rg1 Bd6 Rh1 f4 d3 f6 Ke2 Bf8 Rg1 e4 dxe4 Qb5+ Kf3 Qb8 Rd1 Qc8 Bxf4 Rh7 Rd5 Rb8 Rb1 Qb7 Rd2 c4 Re2 Rg7 Bh6 Qc6 Rd2 c3 Re2 Qd6 Rh1 Rg8 Bf4 Qd7 bxc3 Qg4+ Ke3 Bc5+ Kd3 Qd7+ Kc4 Qb5+ Kd5 Be7+ Kd4 Bc5+ Kd5 Bxf2+ Ke6 Rb6+ Bd6 Qe5#
19,loss,white,stockfish_level_1,N/A,62,d4 d5 e4 dxe4 Bb5+ c6 Bc4 Nf6 Nc3 h6 Nge2 a5 Be3 Nbd7 Nf4 b5 Bb3 e6 Kf1 Bd6 Nfe2 a4 Bf4 Be7 Be5 O-O Bxf6 Nxf6 Nxe4 Nxe4 Qd3 f5 Bxe6+ Kh8 Bxc8 Rxc8 Qe3 Bh4 Qf4 Bg5 Qe5 a3 Rd1 Re8 Qxf5 Nd6 Qg4 axb2 Rb1 Qa5 Ng3 Qc3 Kg1 Qxc2 Rf1 Rcd8 Ne2 Qxe2 Qg3 Qxf1+ Kxf1 b1=Q#
18,loss,black,stockfish_level_1,N/A,135,e3 d5 b3 e5 c4 dxc4 bxc4 Nc6 Nc3 Nf6 Bb2 Bb4 Nf3 Bg4 Be2 Bxf3 Bxf3 e4 Bxe4 Bxc3 Bxc6+ bxc6 Bxc3 O-O Qc2 Ng4 O-O Qd6 f4 Kh8 Qf5 Nh6 Qc2 Ng4 Rf3 Rg8 a4 Rgf8 a5 Rg8 Rd1 Rgf8 h3 Nh6 Kh2 Rg8 c5 Qxc5 Bxg7+ Rxg7 Qxc5 Rd8 Qc2 Rd6 Qb1 Rd8 g4 Kg8 Kg3 Kh8 e4 Kg8 Rff1 Kh8 Kf3 Kg8 d4 Kh8 e5 Re8 Qc1 Re6 Rde1 Kg8 a6 Kh8 f5 Nxf5 Kf2 Nxd4 Qd1 c5 Qb1 Re8 Rh1 Nc6 Re4 Nxe5 Rhe1 Nxg4+ hxg4 Rxe4 Rxe4 Rg8 Re1 Rxg4 Qb8+ Rg8 Qxg8+ Kxg8 Re8+ Kg7 Ra8 Kh6 Re8 Kh5 Re7 Kh4 Ke2 Kh3 Kf2 Kh2 Rxf7 h6 Kf3 Kh1 Rh7 Kh2 Ke4 Kg2 Rxh6 Kf2 Rf6+ Kg2 Ke3 Kh2 Rc6 Kg2 Ke4 Kh2 Kf3 Kh1 Kf2 Kh2 Rh6#
11,loss,white,stockfish_level_1,N/A,236,d4 e6 Nc3 b6 Bf4 a6 Nf3 Bb7 Ne5 Bb4 Kd2 Nc6 Nxc6 Bxc6 Kd3 Ne7 Be5 O-O Qd2 Bb5+ Ke4 Nf5 Bxg7 Nxg7 Kf3 Ne8 Kg3 Qe7 Kh3 d5 Qh6 Bd7 g4 Qf6 Qxf6 Nxf6 Nd1 Bd6 Ne3 a5 Bg2 h5 gxh5 Kh8 Kh4 a4 Nc4 Be7 Kg5 Ng8+ Kf4 f6 Kg3 f5 Kh3 Bf6 Rhd1 f4 Bf3 dxc4 Bxa8 Rxa8 Kg4 f3 Kxf3 a3 Rg1 Ne7 bxa3 Bc6+ Ke3 Nd5+ Ke4 Ra5 Rg6 Kh7 Rh1 Ne7+ Kf4 Rf5+ Kg4 b5 e4 Rxf2 Kg3 Bh4+ Kxh4 Nxg6+ hxg6+ Kg7 d5 exd5 exd5 Bd7 d6 Kh6 dxc7 Rg2 g7 Rg4+ Kh3 Kxg7 Rf1 Rg5+ Kh4 Rc5 Rg1+ Kf7 Rf1+ Kg6 Rg1+ Kf7 Rf1+ Ke7 Re1+ Be6 Rxe6+ Kxe6 a4 Rxc7 axb5 Ke5 Kg5 Rg7+ Kh6 Rb7 Kg6 Rxb5 Kh7 Kf4 Kh8 Ke3 Kh7 Kf3 Kh8 Rd5 Kh7 Rd7+ Kh8 c3 Kg8 Rd1 Kh8 Rd4 Kh7 Rd1 Kh8 Rb1 Kh7 Rb5 Kh8 Ke3 Kh7 Rh5+ Kg7 Kd2 Kf8 Kc1 Kg7 Rd5 Kh8 Rd8+ Kh7 Kb1 Kg7 Ra8 Kh7 Ra7+ Kh8 Ra8+ Kh7 Re8 Kg7 Rc8 Kh7 Re8 Kg7 Re3 Kh8 Rh3+ Kg7 Rh4 Kf8 Kxc2 Kg7 Rd4 Kh8 Rc4 Kh7 Re4 Kh8 Rh4+ Kg7 Ra4 Kh8 Ra8+ Kh7 Re8 Kg7 Ra8 Kh7 Rb8 Kg7 Kd3 Kh7 c2 Kg7 Rb4 a3 Re4 Kh8 Rh4+ Kg7 Rg4+ Kh8 Rf4 Kh7 Rh4+ Kg7 Rd4 Kh8 Rf4 Kh7 c1=Q a4 Qf1 a5 Rb4 a6 Qf7+ Kh6 Rb6+ Kg5 Rg6+ Kh5 Qh7#
22,loss,black,stockfish_level_1,N/A,85,e4 Nf6 Nc3 d5 e5 Bg4 Nf3 Nfd7 Be2 Nc6 d3 Nc5 a3 Rg8 d4 Ne6 Rb1 Rh8 Ng1 Nxe5 dxe5 Bf5 g4 Bg6 h4 Qd7 Bb5 c6 Bf1 d4 Na2 Qd5 f3 Qxa2 Bd2 Bxc2 Qxc2 d3 Bxd3 Nd4 Qd1 Nb3 Rh2 Nxd2 Qxd2 Rd8 Qc2 Rg8 h5 Rh8 Bc4 Rd2 Rxd2 Qxb1+ Qxb1 e6 Bd3 Bc5 Rh2 Bxg1 Rh1 Bd4 a4 Bxe5 Rg1 Bd4 a5 Bxg1 Kf1 Bd4 Bc4 Kf8 a6 bxa6 Kg2 Kg8 b3 a5 Qe4 Bf6 f4 c5 Qa8+ Bd8 Qxd8#
23,loss,white,stockfish_level_1,N/A,96,Nf3 Nf6 d4 d5 Bg5 c6 Nc3 h6 Bxf6 exf6 Qd2 Bb4 Qe3+ Be6 Kd2 Bd6 h3 f5 Kc1 a5 Rg1 O-O Rh1 Re8 Rg1 b5 Rh1 Qc7 Rg1 a4 Rh1 a3 b3 Bf4 Nxd5 Bxe3+ Nxe3 g5 Ne5 Ra7 Rh2 Rb7 Kb1 c5 Kc1 Nc6 Nxf5 Bxf5 Nf3 Bh7 dxc5 Qe7 b4 Rd8 Rb1 Nb8 Rb3 Qf6 e3 Qa1+ Rb1 Qxa2 Nd4 Rbd7 Bxb5 Rb7 Rb3 Be4 Bc4 Rbd7 Bb5 Kh7 Bxd7 Rxd7 b5 Rd8 b6 Nc6 b7 Qa1+ Rb1 Qc3 Rh1 Rxd4 exd4 a2 Rb2 a1=Q+ Rb1 Qcb2+ Kd2 Qc3+ Ke2 Qxc2+ Ke3 Qd3#
9,draw,white,stockfish_level_1,N/A,391,d4 Nf6 e4 e6 Qf3 d5 Bb5+ c6 exd5 cxb5 Nc3 h6 dxe6 fxe6 Nge2 b4 Nb5 Nc6 Be3 Qd7 Kf1 h5 Qf4 Kf7 Nc7 Rb8 Nb5 b6 Nxa7 Qxa7 Rg1 Qb7 Rh1 Kg8 Rg1 Rh6 Qg3 h4 Qf4 Qe7 Rh1 Rb7 Qg5 b5 Nf4 Rd7 Qxb5 Bb7 Nd3 Rh7 Nc5 Rh5 d5 Rdxd5 Qxb7 Qe8 Nb3 Rd8 Qc7 Bd6 Qb6 Ng4 Bd2 Nge5 g4 Rh7 Bf4 Kh8 Bxe5 Nxe5 Nd4 h3 Qa5 Rc8 Qa6 Bb8 Re1 g6 Rg1 Ra7 Qb6 Kg8 Nxe6 Rf7 Ng5 Bc7 Qxb4 Qf8 Qb3 Rb8 Qe6 Qe7 Qxf7+ Qxf7 Nxf7 Kxf7 Rg3 Rxb2 Rc3 Rb7 g5 Kg7 Rc5 Ra7 Ra1 Ng4 Rc6 Bf4 Ke2 Ne5 Re6 Rc7 Kf1 Nf3 Ke2 Nd4+ Kf1 Nxe6 Re1 Nd4 Re4 Rf7 Rxd4 Bxh2 Rh4 Rf5 Rxh3 Bd6 Rh6 Bg3 Kg2 Be5 Kf1 Bg3 Kg2 Bf4 Kh3 Bxg5 Rh4 Be7 Re4 Ba3 Re3 Bc5 Re2 Rf4 Kg3 Ra4 Re5 Rc4 Rd5 Bxf2+ Kxf2 Rf4+ Kg3 Ra4 Rd7+ Kh6 Rd6 Rxa2 c3 Ra8 Kh3 Rf8 Kg4 Ra8 Kh3 Ra1 Kh2 Ra5 Rd2 Rf5 Rg2 Rb5 Kh1 Re5 Rh2+ Kg7 Rg2 Rb5 Kg1 Re5 Kh2 Kh6 Kh3 Rd5 Kh4 Re5 Kh3 Rd5 Kh4 Ra5 Kg4 Rh5 Kf4 Rh1 Ke5 Re1+ Kf6 Kh5 Rxg6 Rc1 Rg3 Kh4 Rf3 Kg4 Re3 Kf4 Rd3 Rf1 Kg7 Rg1+ Kh8 Ke5 Rd4 Rg3 Rc4 Rh3+ Kg8 Rh2 Rg4 Kf5 Rg7 Ra2 Rf7+ Ke4 Re7+ Kd5 Re8 Kc6 Re6+ Kb5 Re4 Ra8+ Kh7 Ra7+ Kg8 Ra8+ Kh7 Ra7+ Kg8 Kc6 Re6+ Kd7 Rf6 Ra8+ Kh7 Ke7 Rf2 Rb8 Kg7 Rc8 Rf7+ Ke8 Rf8+ Kd7 Rxc8 Kxc8 Kh8 Kb7 Kh7 Kc6 Kh8 Kd6 Kh7 Kc6 Kh8 Kd7 Kh7 Kc7 Kh8 Kd6 Kh7 Kc5 Kh8 Kc6 Kh7 Kc5 Kh8 Kb6 Kh7 Ka5 Kh8 Ka6 Kh7 Ka5 Kh8 Kb5 Kh7 Kc4 Kh8 Kc5 Kh7 Kd6 Kh8 Ke7 Kg7 Ke6 Kf8 Kf5 Kg7 Kg5 Kh8 Kf4 Kh7 Kg5 Kh8 Kf6 Kg8 Ke7 Kg7 Kd6 Kh8 Ke6 Kg7 Kd7 Kh8 Kd8 Kh7 Ke7 Kg7 Kd7 Kh8 Ke6 Kg7 Kf5 Kh8 Ke5 Kh7 Ke4 Kh8 Kf4 Kh7 Kf5 Kh8 Ke5 Kh7 Kf4 Kh8 Ke3 Kh7 Kd3 Kh8 Ke4 Kh7 Kf5 Kh8 Ke4 Kh7 Kf4 Kh8 Kg3 Kh7 Kh3 Kh8 Kh4 Kh7 Kh5 Kh8 Kh6 Kg8 Kg5 Kh8 Kh5 Kh7 Kg5 Kh8 Kh5 Kh7 Kg4 Kh8 Kh4 Kh7 Kh5 Kh8 Kh6 Kg8 Kg6 Kh8 Kf6 Kg8 Ke7 Kg7 Kd8 Kh8 Ke8 Kg7 Kd7 Kh8 Ke7 Kg7
27,loss,white,stockfish_level_1,N/A,86,Nf3 Nf6 d4 e6 Bf4 d5 Nc3 c5 Bg5 Nc6 dxc5 Bxc5 Qd3 Qa5 Bxf6 gxf6 Rg1 d4 Nxd4 Bxd4 Qc4 a6 O-O-O Bxf2 Rh1 Be3+ Kb1 f5 Rd3 Ba7 Rd2 Rg8 Ka1 Bd7 Rd3 Rg4 e4 O-O-O h3 Rgg8 exf5 Qb4 Rxd7 Rxd7 fxe6 Rdd8 exf7 Qxc4 Bxc4 Rh8 Be6+ Kb8 Bd7 Nd4 Bf5 Rdf8 Be4 Rxf7 Rd1 Rhf8 Bxh7 Ka8 Bg6 Rf4 Nd5 Rf2 Nc7+ Kb8 Nxa6+ Kc8 Be4 R2f4 Bxb7+ Kxb7 Nb4 R8f7 g3 Rf2 h4 Bc5 h5 Bxb4 Rxd4 Rf1+ Rd1 Rxd1#
21,loss,white,stockfish_level_1,N/A,190,e4 c5 d4 cxd4 Qxd4 Nf6 Qe5 Nc6 Qf5 d6 Qb5 Nxe4 f3 Nc5 Nc3 Bd7 Nge2 e6 Qc4 a6 Be3 b5 Qg4 Ne5 Qh5 g6 Qh3 Nc4 Bd4 f6 Nf4 Ne5 Be2 Qe7 Kf2 d5 Qg3 Nc6 Nxg6 hxg6 Qxg6+ Qf7 Qxf7+ Kxf7 Be3 d4 Bxd4 b4 Be3 Rb8 Nd1 Be7 Bc4 Na5 Be2 Bc6 Bd4 Bb5 Bxb5 axb5 Ne3 e5 Bxc5 Bxc5 Rae1 Nc4 b3 Nxe3 Rxe3 Ra8 Re1 Rxh2 Kg3 Rh7 Re4 Rh6 Rh4 Rg6+ Rg4 Rxa2 Rxg6 Kxg6 Re2 Ra7 Re4 Kf7 Kh3 Rc7 Re2 Rd7 Kh2 Ke7 Kh3 Rd8 Kg4 Ba7 Kf5 Bg1 f4 Bd4 Rd2 Rc8 Rd3 Rg8 Rd2 Rh8 Ke4 Rc8 Kf5 Kf7 Rd3 Ke7 Rd2 Rg8 Rd3 Rxg2 Rd1 Kd6 fxe5+ fxe5 Kf6 Rg3 Kf7 Rg2 Kf8 Ke6 Rd3 Re2 Kg8 Rxc2 Rf3 Rc8+ Kh7 Rd8 Kg7 Kd5 Kh7 Ra8 Rf5 Ra1 Kg8 Ra7 Rf8 Bg1 Re8 Ke4 Kh8 Bc5 Kg8 Be3 Kh8 Ra3 Kg8 Rxb3 Re7 Bc1 Kh8 Rh3+ Kg8 Rg3+ Kh8 Rc3 Re8 Rh3+ Kg8 b3 Kf7 b4 Rb8 Bd2 Re8 Rh4 Rd8 Bh6 Re8 Be3 Rb8 Bc5 Re8 b2 Rxe5+ Kxe5 Kg7 b1=Q Kf7 Rh7+ Ke8 Qe4 Kd8 Qa8#
25,loss,white,stockfish_level_1,N/A,112,Nf3 c5 e4 e6 Bb5 Nf6 Nc3 Be7 e5 Nh5 Ne2 g6 Kf1 O-O Rg1 d6 g4 Qa5 Bc4 b5 b4 Qc7 exd6 Qxd6 bxc5 Qd7 Ne5 Qc7 Nxg6 fxg6 Bb3 Qxh2 Bxe6+ Bxe6 Rg2 Qh1+ Rg1 Ng3+ Nxg3 Qh2 Rg2 Qh4 Qe2 Bc4 d3 Bf7 Qe4 Bf6 Qxa8 Bxa1 Qxa7 Nc6 Qd7 Qf6 Ne4 Qe6 Qc7 Bg7 a3 Nd4 c3 Nb3 Ng5 Qd5 Nxf7 Qxd3+ Kg1 Nxc1 Qe7 Qd5 Nh6+ Bxh6 g5 Bg7 Kh2 Qe5+ Qxe5 Bxe5+ Kh3 Ne2 a4 Nf4+ Kg3 Ne6+ Kh4 Bxc3 axb5 Ba5 c6 Re8 Kg4 Bb6 Rh2 Bc7 Rh6 Nxg5 Kxg5 Rf8 Rh4 Rf5+ Kg4 Rxf2 Kg5 Kg7 Re4 Kf7 Kh6 Rf3 Kxh7 Rh3+ Rh4 Rxh4#
24,loss,black,stockfish_level_1,N/A,209,c4 Nf6 e3 d5 Be2 dxc4 Na3 Be6 Qc2 Nc6 Bxc4 Bg4 h3 Bh5 Bb5 Qd7 d4 Bg6 Qa4 Be4 f3 Bd5 Nc4 Bxc4 Bxc4 Nxd4 Bxf7+ Kxf7 Qxd4 Qb5 a4 Qc6 Bd2 Qc2 Ne2 Rg8 Kf2 Rh8 a5 Rg8 Bc3 Kg6 Rhd1 e5 Qc4 Be7 Rac1 Ne4+ Kf1 Nd2+ Bxd2 Qxb2 Bc3 Qa3 Bd2 Qd6 Bc3 Qc5 Qe6+ Bf6 e4 Kh6 Bd2+ Kg6 Rxc5 Rge8 Qxe8+ Rxe8 Rd5 Re7 g4 Bg5 h4 Bxh4 Be3 Rf7 f4 Bg5 Bc1 Bxf4 Kg2 Bxc1 Kh1 Bb2 Rb5 Rf2 Rxb2 Kg5 Rdb1 Kh4 Ng1 Rxb2 Rxb2 Kxg4 Rg2+ Kf4 Ne2+ Kf3 Rg5 Kxe2 Rxg7 Kf3 Rf7+ Kxe4 Kg2 b6 Rxc7 bxa5 Rxa7 Ke3 Rxa5 Kf4 Ra7 h6 Rc7 Kg4 Rd7 Kf4 Rh7 Kg5 Rh8 Kg6 Rf8 Kg7 Rd8 Kg6 Ra8 Kg7 Kh2 Kg6 Rf8 Kg5 Rh8 Kg6 Re8 Kf5 Rf8+ Kg5 Rh8 Kg6 Ra8 Kg5 Ra6 Kh5 Ra5 Kg5 Rb5 Kf4 Kg2 Ke4 Rb8 Kf4 Rh8 Kg5 Kg3 Kh5 Kf3 Kg5 Kg3 Kh5 Rh7 Kg6 Re7 Kf6 Rh7 Kg6 Re7 Kf6 Rc7 Kg5 Kh3 Kf4 Kh2 Kg5 Rg7+ Kh5 Kh3 e4 Kg2 Kh4 Rg6 Kh5 Re6 e3 Kf1 Kg5 Rxe3 Kg4 Rb3 Kh4 Ra3 Kg4 Ra1 Kg3 Rb1 Kh2 Rb6 h5 Rb5 h4 Rf5 Kh1 Rh5 Kh2 Rh8 h3 Kf2 Kh1 Rxh3#
30,loss,black,stockfish_level_1,N/A,55,e4 e5 Be2 Nf6 d3 Bb4+ c3 Bc5 Nf3 Nc6 b4 Bb6 Qc2 Kf8 Nbd2 Qe7 Nc4 Qe6 b5 Bxf2+ Kxf2 Ng4+ Ke1 Ne7 d4 exd4 Ba3 d6 h3 d3 Qxd3 Nf6 Ng5 Qd7 Ne3 Rg8 h4 Rh8 Rf1 Rg8 Qc4 Ng6 Rd1 Nxh4 e5 Nf5 Rxf5 Qe8 Qxc7 Bxf5 Nxh7+ Bxh7 Qxd6+ Qe7 Qxe7#
20,loss,black,stockfish_level_1,N/A,321,c4 e5 e3 d5 cxd5 Qxd5 a3 Qc6 b4 Bf5 Bb2 Bc2 b5 Qe4 Nc3 Qf5 Qf3 Bxa3 Rxa3 Nc6 e4 Bxe4 Nxe4 Nge7 Ra1 Kf8 Rc1 Nd4 Qxf5 Nexf5 Ne2 Rg8 f3 Rh8 h4 Nxh4 Ba3+ Kg8 Kf2 Nhxf3 gxf3 Nxb5 Bb2 Rd8 Bxe5 Re8 Bf4 c6 Ra1 Re7 Be3 a6 Bg5 Re6 Bg2 Kf8 Rad1 Kg8 Rb1 Nc7 Bf4 Nd5 Bg5 b6 Bf1 Kf8 Bg2 Kg8 Bf1 Kf8 Bh3 Re8 Rh2 Rg8 Nc1 Re5 Na2 Rh8 d4 Re8 Bf5 h6 Bg4 Rh7 Bd2 h5 Bxh5 Re7 Bg5 Re8 Rbh1 Re6 Nc1 Re8 Rg1 Re6 Ke1 Re8 Rf1 Re6 Ne2 Re8 Rfh1 Re6 N2g3 Re8 Bg4 Rxh2 Rxh2 Kg8 Bd2 Re7 Bh5 f6 Bg6 b5 Re2 Kf8 Nf1 Re6 Rh2 Ke7 Rh8 Kd7 Ng3 c5 Nf5 cxd4 Nxg7 Re5 Rh4 Kc6 Rh2 Kb7 Nf5 Kb6 Nxd4 Re7 Bh5 Re5 Bg4 Re8 Ne6 Re7 Nf4 Nxf4 Bxf4 Kb7 Bc1 a5 Bb2 f5 Bxf5 b4 Bg4 a4 Bf6 Rf7 Bb2 Re7 Rg2 Ka8 Rc2 Re8 Rh2 b3 Re2 Re7 Rf2 Re8 Bd7 Re7 Bxa4 Re6 Bd7 Re7 Rd2 Kb8 Ke2 Kc7 Bf5 Kb7 Bf6 Rf7 f4 Ka8 Rd1 b2 Ke3 Rxf6 Nxf6 Kb7 Rd5 Kc6 Bc2 Kb7 Kd4 Kb6 Bb1 Kb7 Rb5+ Ka8 f5 Ka7 Be4 b1=Q Rxb1 Ka6 Rb3 Ka5 Rb1 Ka4 Ke5 Ka3 Bf3 Ka2 Rd1 Kb2 Rd7 Kc2 Be4+ Kc3 Rg7 Kb2 Rg8 Ka2 Nh7 Kb3 f6 Kb2 Ng5 Kc3 Rg7 Kb3 Bd5+ Kc2 Rg8 Kb2 Ne4 Kc2 Ng3 Kb2 Rg6 Kc2 Nf5 Kc1 Rg7 Kc2 Rg6 Kc1 Rg4 Kc2 f7 Kb2 Rg2+ Kc1 Rg4 Kc2 Rg2+ Kc1 Re2 Kd1 Rh2 Kc1 f8=R Kb1 Rg2 Ka1 Rg1+ Kb2 Rg2+ Ka1 Bc4 Kb1 Rg1+ Kc2 Rg5 Kc3 Kf6 Kxc4 Re8 Kb3 Rg3+ Kc2 Re2+ Kd1 Re8 Kc2 Nd4+ Kb2 Rb3+ Kc1 Ne2+ Kc2 Rb6 Kd3 Rd8+ Kxe2 Rdd6 Kf2 Kg5 Kg2 Rb5 Kh2 Rc6 Kg2 Ra6 Kh2 Raa5 Kg2 Ra6 Kh2 Ra1 Kg3 Re5 Kf2 Ra2+ Kf1 Rc2 Kg1 Re1#
31,loss,white,stockfish_level_1,N/A,82,Nf3 e6 e4 Nf6 Ng5 h6 Qf3 hxg5 Nc3 Nc6 Bb5 a6 Bxc6 bxc6 Kf1 d5 exd5 cxd5 Rg1 Be7 Rh1 a5 Kg1 g4 Qf4 Ra6 Qg5 O-O Kf1 e5 Qxe5 a4 Rg1 Re6 Qf5 d4 Nb5 Rb6 Qg5 Re8 Qe5 Ba6 Qg5 d3 Nxc7 Qxc7 c3 Rd6 Qe5 Bf8 Qf4 Qd8 Qxa4 Qc7 Qf4 Ree6 Qg3 Qb7 Qf4 Rd5 Qa4 g6 Rh1 Rf5 Rg1 Rh5 Rh1 g5 Rb1 g3 fxg3 g4 Qf4 Qc6 c4 Rhe5 Qf2 Re2 Qg1 Re1+ Kf2 Bc5#
29,loss,white,stockfish_level_1,N/A,88,e4 e6 Nf3 Nf6 Ng5 h6 Qf3 hxg5 Nc3 d6 Bb5+ Nc6 Bxc6+ bxc6 O-O e5 Kh1 Be7 Rg1 d5 exd5 g4 Qe3 cxd5 Qxe5 Be6 Qe3 Kf8 Qe5 Rh5 Qe3 c6 Qe2 c5 Qa6 d4 Nb5 Qd7 Nxa7 Qc7 h3 c4 Rf1 Bd5 Kg1 Qd7 Qa5 Bd6 Re1 gxh3 gxh3 Rxh3 Kf1 Qg4 Re8+ Nxe8 Qxd5 Rxa7 Qc6 Re7 Qd5 Rh6 Qc6 Re5 Rb1 Qh3+ Qg2 Qd7 Qf3 f6 Qg2 Qf7 Qc6 Rhh5 Ra1 f5 Rb1 Rh8 Ra1 Qe6 Kg2 f4 Kf3 Qf5 Qxc4 Qh5+ Kxf4 Re3#
26,win,black,stockfish_level_1,N/A,260,c4 e5 e3 d5 Be2 dxc4 Nc3 Nf6 d4 cxd3 Qxd3 Nc6 Qxd8+ Kxd8 Bc4 Bb4 Bxf7 Bf5 Bd2 Kc8 Nge2 Rf8 Bb3 Rh8 f3 Rf8 g4 Bd7 a3 Ba5 g5 Ne8 Bd5 Ne7 Be4 Nd6 Rd1 Bxc3 Nxc3 Nc4 Rc1 Rf7 Rc2 Be6 h4 Kb8 h5 Kc8 Na4 Kb8 g6 hxg6 Bxb7 Kxb7 Nc5+ Kc8 Nxe6 Nxd2 Kxd2 Nf5 hxg6 Rd7+ Ke1 Nxe3 Rc5 Rd1+ Ke2 Rxh1 Rxe5 Nc4 Rg5 Rh2+ Kf1 Ne3+ Kg1 Rxb2 Nc5 Rb5 a4 Ra5 f4 Rb8 Kh1 Ra8 Kh2 Rb8 Kg1 Ra8 Kh2 Rb8 Re5 Ng4+ Kh1 Nxe5 Kg2 Rb2+ Kg3 Nxg6 Ne6 Rxa4 Nc5 Rc4 Na6 Kb7 Nxc7 Rxc7 f5 Ne7 Kh3 Nxf5 Kg4 Nd4 Kf4 Ka8 Ke3 Rd7 Kf4 Rb5 Kg4 Rf7 Kh4 Re7 Kh3 Rh5+ Kg3 Rf7 Kg4 Re5 Kg3 Rh5 Kg2 Re7 Kf1 Rf5+ Kg2 Rh5 Kf2 Rf5+ Kg1 Re2 Kh1 Rc5 Kg1 Kb8 Kh1 Kc8 Kg1 Kd8 Kf1 Ke8 Kg1 Kf8 Kf1 Kg8 Kg1 Kh8 Kh1 Kg8 Kg1 Kh8 Kh1 Kg8 Kg1 Kh8 Kh1 Kg8 Kg1 Kh8 Kh1 Kh7 Kg1 Kg8 Kh1 Kh8 Kg1 Kg8 Kh1 Kh8 Kg1 Kg8 Kh1 Kh8 Kg1 Kg8 Kh1 Kh8 Kg1 Kh7 Kh1 Kh6 Kg1 Kh7 Kh1 Kh6 Kg1 Kh7 Kf1 Kh6 Kg1 Kh7 Kh1 Kh6 Kg1 Kg6 Kh1 Kh7 Kg1 Kh6 Kf1 Kh7 Kg1 Kh6 Kf1 Kh7 Kg1 Kh6 Kf1 Kg6 Kg1 Kf7 Kh1 Kf8 Kg1 Ke8 Kh1 Kf8 Kg1 Ke8 Kh1 Kf8 Kg1 Ke8 Kh1 Kf8 Kg1 Ke8 Kf1 Kd8 Kg1 Kc8 Kf1 Kd8 Kg1 Kc8 Kh1 Kd8 Kg1 Kc8 Kh1 Kd8 Kg1 Kc8 Kh1 Kb8 Kg1 Ka8 Kf1 Kb8 Kg1 Rc1#
28,loss,black,stockfish_level_1,N/A,209,d4 e5 g3 Nc6 d5 Bb4+ c3 Nge7 dxc6 dxc6 Bg2 Bxc3+ bxc3 Qxd1+ Kxd1 Bg4 f3 O-O-O+ Bd2 Be6 h4 Nf5 g4 Ne3+ Kc1 Nxg2 a4 f6 Rh2 Nxh4 Rxh4 g5 Rh2 Bc4 Kb2 Rd7 Be3 Rd1 a5 Kb8 Na3 Bxe2 Rxd1 Bxd1 Bc5 Ka8 Kc1 Rd8 Nb1 Rd5 Ba3 Rd7 Bb4 Kb8 Nd2 Ka8 Rg2 c5 Ba3 Rd8 Bxc5 Rd5 Kxd1 Rxc5 Ne2 Rd5 Kc2 Rc5 a6 bxa6 c4 Rc6 Rg1 Rc5 Nc1 Rc6 Na2 Rc5 Nc1 Rc6 Na2 Rc5 Kc3 a5 Kc2 Rc6 Rf1 Rc5 Rh1 Rc6 Rxh7 Kb7 Rh1 Ka6 Rb1 Rc5 Nc3 Rc6 Nd1 Rd6 Rb2 Rd8 Nf2 Rd4 Nfe4 a4 Ra2 Ka5 Ng3 Kb4 Ne2 Rd7 Nc1 a3 Ra1 Rd8 Na2+ Kc5 Re1 Rd4 Nc1 Kc6 Ncb3 Rf4 Rh1 a2 Ra1 Kb6 Kc1 Kc6 Kc2 Kb6 Kd1 Kc6 Nc1 Rd4 Nb3 Rd7 Na5+ Kb6 Rxa2 c5 Ke2 Rd4 Nf1 Rf4 Ke1 Rxf3 Nd2 Rc3 Kf2 Kc7 Nf1 Kb6 Nd2 Kc7 Ke2 Kb6 Ne4 Rc1 Nd6 Rc3 Ra1 Rc2+ Kd3 Rg2 Ke3 Rxg4 Nab7 Rf4 Ra3 Rg4 Ra1 Rf4 Nd8 Kc7 N8f7 Kb8 Rd1 Ka8 Rd5 Rd4 Nh6 Rh4 Ndf5 Rh3+ Ke4 Rc3 Nd6 Rc2 Kd3 Rc1 Kd2 Rh1 Ng4 Rh4 Nxf6 Rh6 Nfe4 Rg6 Rd3 Re6 Ke2 Rg6 Rf3 Re6 Rf8+ Re8 Rxe8#
33,loss,white,stockfish_level_1,N/A,72,Nc3 d5 e4 Nf6 Bb5+ Nbd7 e5 c6 exf6 cxb5 Qg4 g6 Nxd5 e6 Qe4 a6 Nf3 Nxf6 Nxf6+ Qxf6 Ne5 Bd6 Ng4 Qe7 Qd4 e5 Nxe5 Bxe5 Qe4 O-O Kf1 Bf5 Qd5 Rae8 Rg1 Bc7 g3 Bb6 Qf3 h5 Qd1 Bg4 f3 Be6 Rg2 Bh3 Rb1 Qd7 Ra1 Qe7 Rb1 Qe5 Ra1 Qf5 Rb1 b4 Ra1 Bd4 Rb1 a5 Ra1 Re6 Rb1 Rc8 Ra1 Rxc2 Rb1 Qb5+ Qe2 Rxc1+ Rxc1 Qxe2#
36,loss,black,stockfish_level_1,N/A,53,d4 Nf6 Nc3 e5 e4 Bb4 Ne2 Nxe4 Qd3 Qh4 g3 Qg4 dxe5 Nc6 f4 Nc5 Qe3 Kf8 Bg2 Ne7 O-O Nf5 Qf3 Qxf3 Rxf3 Nxg3 Nxg3 Ne6 f5 Nd4 Rf2 Bxc3 bxc3 Nb5 h3 Nxc3 f6 gxf6 Rxf6 Kg8 Bh6 Rb8 Raf1 Nxa2 Nh5 Nb4 R6f3 f5 h4 Nxc2 Rxf5 Ra8 Rg5#
34,loss,black,stockfish_level_1,N/A,87,c4 Nc6 d4 e5 e3 Bb4+ Ke2 exd4 Nf3 Qf6 Qb3 Nge7 exd4 Qf5 Kd1 Kf8 d5 Nxd5 cxd5 Bd6 Nc3 Na5 Qc2 Qf6 Bd2 Kg8 h3 Kf8 h4 Kg8 Be2 Kf8 Rc1 Kg8 h5 Kf8 h6 g6 Qb1 Rg8 Ne4 Qf5 Ke1 Qxd5 Rh4 Be7 Rh1 Nc6 Nc3 Qc5 Ne4 Qd5 Neg5 Bxg5 Bxg5 Qa5+ Bd2 Qd5 Kf1 Rh8 b3 Rg8 a4 Rh8 Rh4 Rg8 Bg5 Rh8 Qa1 Ne5 b4 Rg8 Rc5 Qd6 Rxe5 f6 Bc4 fxe5 Re4 Qxb4 Nxe5 d6 Nd3 Be6 Qf6+ Ke8 Qe7#
38,loss,black,stockfish_level_1,N/A,59,e3 Nc6 Nc3 d5 Nf3 Bg4 d4 Nf6 h3 Bh5 Bd2 Qd6 Be2 Qb4 O-O Qxb2 Bb5 Bxf3 gxf3 O-O-O a4 Nb4 Qe2 Nxc2 Rab1 Qa3 Bd3 Nxd4 exd4 Rd7 Rfd1 Rg8 Rdc1 Rh8 Nb5 Qxa4 Be3 Qa6 Qc2 Kb8 Bf4 Qb6 Nxc7 Qxd4 Bg3 e5 Nb5 Qc5 Bxe5+ Ka8 Ra1 Ne4 Qb2 Qxf2+ Qxf2 Bc5 Rxa7+ Bxa7 Qxa7#
40,loss,black,stockfish_level_1,N/A,59,c4 Nf6 d4 e5 dxe5 Bb4+ Nc3 Ne4 Qc2 Qh4 e3 Nxf2 Qxf2 Bxc3+ bxc3 Qg4 Be2 Qe4 c5 Qc2 Bd2 Nc6 Nf3 Kf8 e4 Qxe4 O-O-O Rg8 Rde1 Rh8 c4 Rg8 Kb2 Rh8 Rhg1 Rg8 g4 Rh8 h4 Rg8 g5 Rh8 e6 Qxe6 Bd3 Qh3 Qe3 Ne5 Qxe5 Qe6 Qxc7 Qxe1 Bxe1 Ke8 Bd2 Ke7 Re1+ Kf8 Qd8#
39,loss,white,stockfish_level_1,N/A,74,d4 Nf6 Nf3 e6 Bf4 a5 Nc3 Bb4 Qd3 O-O Ne5 d6 Nc4 d5 Be5 dxc4 Bxf6 Qxf6 Qxc4 e5 Qxc7 Nc6 dxe5 Nxe5 O-O-O Be6 Qxb7 Rab8 Qc7 Ng4 Rd2 Nxf2 Rg1 Rbd8 Rxd8 Qxd8 Qxd8 Rxd8 Kb1 Bc5 Ka1 Kf8 Kb1 h5 Ka1 Ng4 Rh1 Be3 Kb1 h4 Ka1 Nf2 Rg1 f5 Kb1 a4 Ka1 Ng4 Rh1 g5 Kb1 Nf2 Rg1 g4 Ka1 Rd2 Kb1 f4 a3 Kg7 Na2 Rd1+ Nc1 Rxc1#
32,win,black,stockfish_level_1,N/A,234,c4 e5 e3 d5 Be2 dxc4 Nf3 Nc6 O-O Bg4 d4 exd4 Nxd4 Bxe2 Nxe2 Qf6 Qc2 Qh4 Nd2 Nf6 Nxc4 Qg4 b3 Bc5 h3 Qe6 Bb2 Nb4 Qb1 Ne4 Bxg7 Rg8 Be5 Qd5 Bxc7 Nc3 e4 Bxf2+ Rxf2 Rxg2+ Kf1 Rxf2+ Kxf2 Qc5+ Ke1 Nxb1 Bd6 Nc2+ Kf1 Nd2+ Kg2 Qg5+ Kh2 Nxe4 Rf1 Qd5 Nf4 Qc6 Ne6 Nxd6 Ng7+ Kd8 Rd1 Nd4 Rxd4 Qc5 a4 Qxd4 Ne6+ fxe6 Kg2 Qd5+ Kh2 Nf5 Nb6 axb6 a5 bxa5 h4 Nxh4 Kg3 Nf5+ Kh2 Qxb3 Kg2 Kc8 Kg1 Kb8 Kh1 Qc2 Kg1 Ne3 Kh1 Kc8 Kg1 Kd8 Kh1 Ke8 Kg1 Kf8 Kh1 Kg8 Kg1 Kh8 Kh1 Kg8 Kg1 Kh8 Kh1 Kg8 Kg1 Kh8 Kh1 Kg8 Kg1 Kh8 Kh1 Kg7 Kg1 Rh8 Kh1 Rg8 Kg1 Rh8 Kh1 Rg8 Kg1 Rh8 Kh1 Rg8 Kg1 Rh8 Kh1 Rg8 Kg1 Rf8 Kh1 Rh8 Kg1 Rg8 Kh1 Rh8 Kg1 Rg8 Kh1 Rh8 Kg1 Rg8 Kh1 Rh8 Kg1 Rg8 Kh1 Rf8 Kg1 Re8 Kh1 Rf8 Kg1 Re8 Kh1 Rf8 Kg1 Re8 Kh1 Rf8 Kg1 Re8 Kh1 Rd8 Kg1 Rf8 Kh1 Re8 Kg1 Rf8 Kh1 Re8 Kg1 Rf8 Kh1 Re8 Kg1 Rd8 Kh1 Re8 Kg1 Rd8 Kh1 Rc8 Kg1 Rd8 Kh1 Rc8 Kg1 Rd8 Kh1 Rc8 Kg1 Rb8 Kh1 Rd8 Kg1 Rc8 Kh1 Rd8 Kg1 Rc8 Kh1 Rd8 Kg1 Rc8 Kh1 Rb8 Kg1 Rc8 Kh1 Rb8 Kg1 Ra8 Kh1 Rc8 Kg1 Rb8 Kh1 Ra8 Kg1 Rb8 Kh1 Ra8 Kg1 Rb8 Kh1 Qg2#
35,loss,white,stockfish_level_1,N/A,122,d4 d5 Nc3 Bf5 Nf3 e6 Bg5 Nf6 Ne5 c6 Qd2 Qb6 Na4 Qc7 Nc3 Na6 Qf4 Nb4 Bxf6 gxf6 O-O-O Bd6 Nxd5 cxd5 Rd2 Rg8 Kb1 a6 Ka1 b6 Qf3 Rc8 Nxf7 Qxf7 c3 b5 Rg1 Be4 Qe3 Nc6 Rh1 Rb8 Rg1 Rd8 Rh1 f5 Rg1 Rd7 Rh1 h5 Rg1 Qe7 Rh1 h4 Rg1 Qf8 Rh1 Nd8 Rg1 Qe7 Rh1 Bc7 Rg1 Bd6 Rh1 Rf8 Rg1 f4 Qh3 Ra7 f3 Bh7 Qg4 Rf7 Qh5 Rc7 Rh1 Rd7 Rg1 Rc7 Rh1 b4 Rg1 Qf8 Rh1 bxc3 bxc3 Rb7 Rd1 Ra7 Qxh4 Qg7 Qh5 Bg6 Qg5 Rab7 Qg4 Rbd7 Rd2 Ra7 Qg5 Rab7 Rc2 Be7 Qg4 a5 Rg1 Bd6 Qg5 a4 Qg4 Rb6 Qg5 Rbb7 Qg4 e5 dxe5 Bxe5 Qg5 Bxc3+ Rxc3 Rb1#
37,loss,white,stockfish_level_1,N/A,166,Nc3 c6 e4 g6 Qf3 Bg7 Bc4 e6 Nce2 d5 exd5 cxd5 Bb5+ Kf8 Qa3+ Qe7 Qf3 Nf6 Qf4 Qc5 Nd4 g5 Qe5 Ne4 Nxe6+ fxe6 d4 Nc6 Qxg7+ Kxg7 dxc5 Nd4 Bd3 Nxc5 Bxg5 Nxd3+ cxd3 h6 Ne2 Nf3+ gxf3 Kf7 Be3 e5 Nc3 Bd7 Nxd5 Bc6 Nc7 Rac8 Rc1 Rxc7 Bxa7 Rhc8 Bb6 Rd7 Kd2 Ra8 Ke3 Rd6 Bc7 Rf6 Bxe5 Rxf3+ Kd4 Ke6 Rc2 Ra4+ Rc4 Ra6 Rc2 Ra4+ Rc4 Ra8 Rc2 Rd8+ Kc5 Rf5 Re1 Rxe5+ Rxe5+ Kxe5 Kb6 Rxd3 Rc5+ Kf6 Rh5 Kg6 Rh4 h5 Ka7 Rf3 Rc4 Rf5 Rc2 Bf3 Rc7 Rf4 Re7 Kf6 Re8 Ra4+ Kb8 Kf7 Re3 Rf4 Rb3 Kf6 Rb6+ Bc6 f3 Ke5 Ka7 Ra4+ Kb8 h4 f4+ Kxf4 b3 Rd4 Ka7 Kg4 h3+ Kxh3 b4 Rg4 a3 Kg3 a4 h3 a5 h2 Rxc6 h1=Q Rb6 Kf3 Kxb7 Kf4+ Kb8 Qh8+ Ka7 Qe5 Ka8 Rg8+ Ka7 Qg7+ Rb7 Qd4+ Rb6 Rf8 a6 Qd7+ Rb7 Qc6 b5 Qc2 Rg7 Qf5 b6 Qc5 Rc7 Qd6 b7 Qd4+ Rc5 Qxc5#
47,win,white,stockfish_level_1,N/A,55,e4 e5 d4 d6 dxe5 Nc6 Bb5 Bd7 exd6 Bxd6 Bxc6 bxc6 Nc3 Rb8 Nf3 h6 h4 Ne7 Kf1 Qc8 Qd3 f6 Rg1 c5 Rh1 Nc6 Rg1 Bg4 Bxh6 Bxf3 Bxg7 c4 Qxf3 Be5 Bxh8 Rxb2 Qh5+ Kf8 Nd5 Nd4 c3 Ne2 Rh1 c6 Ne3 Bxc3 Nxc4 Rc2 Nd6 Ng3+ fxg3 Qe6 Qh6+ Kg8 Qg7#
43,loss,white,stockfish_level_1,N/A,126,e4 c5 Nc3 Nc6 Bb5 g6 Nf3 d6 Nd5 Bh6 Kf1 e5 Qe2 Be6 Nc3 Nf6 Qd3 Kf8 Bxc6 bxc6 Nxe5 dxe5 Qa6 Qb6 Qa4 Rd8 Rg1 Rd4 Nd5 Rxd5 exd5 cxd5 Rh1 d4 Rg1 e4 Rh1 Kg8 Rg1 Bd7 Qc4 a5 Rh1 Kg7 Rg1 Bb5 Qxb5 Qxb5+ d3 Qb8 Bxh6+ Kxh6 Rb1 Qc8 Rd1 a4 dxe4 Ne8 Ke1 f6 Rh1 Rf8 Rg1 Nc7 Rh1 Ne8 Rg1 f5 exf5 Rxf5 Kf1 Rf8 Rd2 Nc7 Rh1 Ne8 Kg1 g5 Rd3 Kg6 Rh3 h5 Rd3 Nf6 Rf3 Qb8 b3 Rg8 b4 h4 c3 Qe8 Kf1 Rf8 c4 cxb4 Rg1 Kh5 Rf5 Kh6 Rf3 b3 axb3 a3 Rf5 Rf7 Rf3 Qa8 Rf5 h3 gxh3 Qe4 Rfxg5 a2 Rg6+ Kh7 Rg7+ Kh8 Rg8+ Nxg8 Rxg8+ Kxg8 f3 a1=R+ Kg2 Qxf3#
42,loss,black,stockfish_level_1,N/A,149,e4 d5 e5 Nf6 Nf3 Bg4 exf6 Nc6 c3 gxf6 d4 Bg7 Be2 Kf8 Nh4 Bxe2 Kxe2 Qd7 Kf1 Qe6 a4 Qe4 f4 Rg8 Na3 Rh8 Nc2 Rg8 Qe2 Qxe2+ Kxe2 Bh6 Kf2 Rg7 Re1 Kg8 a5 Kh8 g3 Rag8 a6 bxa6 Re2 a5 Bd2 Rb8 Ra2 Rb7 Be3 Rb8 Ne1 Rb7 Nef3 e6 Ke1 Rb8 Kf2 Rb7 Nd2 Rb8 Re1 Rb7 Rb1 Rb8 Ndf3 Rb7 h3 Rb8 b3 Rb7 Nd2 Kg8 Nf1 Kh8 Raa1 Kg8 g4 Kh8 Ng3 Kg8 Nh5 Nxd4 Bxd4 Bxf4 Nxf6+ Kh8 Kg2 Bg5 Nf3 Bxf6 Bxf6 Kg8 Bh4 Rb5 Kg1 Kh8 Kh1 Rc5 Bf6 Kg8 Bxg7 Kxg7 Rc1 Kh8 Ra2 Kg8 Rac2 Kh8 Rb1 Rc6 c4 Rc5 g5 Rc6 Ra1 Rc5 Re1 Rc6 Rd2 dxc4 bxc4 Rxc4 Red1 Rc5 h4 Kg7 Kg1 Kg6 Rd8 Kh5 Re1 Rf5 Nd2 Kxh4 Re2 Rxg5+ Kf2 Kh3 Rd3+ Kh2 Kf1+ Rg2 Nf3+ Kh1 Rdd2 Rxe2 Rxe2 h6 Rh2#
41,loss,white,stockfish_level_1,N/A,210,e4 e6 Nc3 c5 Bb5 Nf6 Qf3 Qc7 Nge2 Nc6 Bxc6 Qxc6 Kf1 d5 exd5 Qa6 dxe6 fxe6 Qf4 Bd6 Qg5 e5 Qxg7 Rf8 Rg1 e4 h4 Bg4 f3 Be6 fxe4 Nh5+ Qxf8+ Bxf8 Kf2 Bg7 Nd5 Qd6 Kf3 c4 Ne3 O-O-O Kf2 Rf8+ Ke1 Qe7 Rh1 Qf7 Rf1 Qg8 Nxc4 Bf6 Nd6+ Kb8 Kd1 a6 Rf2 Qg7 a3 Ka8 Rb1 h6 Ra1 Rd8 Nxb7 Rf8 Nc5 Bc4 d3 Rc8 dxc4 Rxc5 Bxh6 Qxh6 g4 Rxc4 g5 Qg7 gxf6 Qh6 Rf5 Rc7 Ke1 Rd7 Kf2 Nxf6 Rf4 Qh5 Rxf6 Qxh4+ Kg2 Qxe4+ Kf2 Rd8 Rxa6+ Kb7 Rh6 Re8 Nc3 Qf4+ Kg2 Rg8+ Rg6 Qd2+ Kh3 Qd7+ Kh4 Qd8+ Kh5 Qa5+ Kh6 Rh8+ Kg7 Qd8 Rg2 Qd4+ Kg6 Rg8+ Kf7 Rd8 Rd1 Qc4+ Nd5 Rxd5 Rxd5 Qxd5+ Kg7 Qd4+ Kg8 Qd5+ Kh8 Qxg2 Kh7 Ka7 Kh8 Qg5 Kh7 Ka8 Kh8 Qe5+ Kh7 Qf6 c3 Kb8 Kg8 Ka8 Kh7 Kb8 Kg8 Kc8 Kh7 Kd8 Kg8 Ke8 a4 Qh6 a5 Qd2 a6 Qd5+ Kg7 Qd7+ Kg8 Qe7 Kh8 Qe5+ Kg8 Qe3 Kg7 Qa7+ Kh8 Qxa6 Kg8 Qf6 Kh7 Ke7 Kg8 Ke6 Kh7 Qe5 Kg8 Qf5 Kg7 Qg5+ Kh8 Qh4+ Kg7 Qg5+ Kh8 Qf6+ Kg8 Kf5 Kh7 Qg5 Kh8 Qf6+ Kh7 Qe7+ Kh8 Qh4+ Kg8 Kf6 b3 Qh5 c4 Qg5+ Kf8 Qg4 Ke8 Qc8#
45,loss,white,stockfish_level_1,N/A,182,Nf3 e6 e4 c5 Bb5 Nf6 Nc3 Nc6 e5 Ng4 Ne4 Ncxe5 Nfg5 a6 Be2 d5 Nxf7 Kxf7 Bxg4 dxe4 Bh3 g6 Kf1 h5 Qe2 Qd4 Rg1 Bh6 Rh1 Bd7 Rg1 Raf8 Rh1 Ke8 Rg1 Bb5 c4 Qxf2+ Qxf2 Bxc4+ Ke1 Nd3+ Kd1 Bb3+ axb3 Rxf2 Bxe6 Rhf8 Ra2 Kd8 Bd5 Nb4 d3 Bxc1 Rxa6 Nxa6 Kxc1 Rf1+ Rxf1 Rxf1+ Kd2 Rb1 Kc2 Rf1 Bxb7 Rf8 Bxa6 Rf2+ Kc3 e3 Bb7 h4 Be4 e2 Kd2 Ke7 Ke1 Rf4 Bxg6 Rg4 Be4 Rg7 Kxe2 Ke6 Bc6 Kd6 Be4 Ke6 Bc6 Ra7 Kf3 Rh7 Kg4 Rc7 Be4 Rg7+ Kxh4 Rd7 Kh5 Ke5 Kg5 Rc7 Bg6 Rb7 Kh6 Rb8 Bf7 Kf6 Bg6 Rb4 Kh7 Rh4+ Bh5 Kg5 g4 Kf6 b4 cxb4 g5+ Kxg5 Kh8 Kf6 Kh7 Rxh5+ Kg8 Ke6 Kf8 Kd6 Kg7 Kd7 Kf8 b3 Kg7 Ke6 Kf8 Rg5 d4 Rg1 h3 Rg3 h4 Kf6 Ke8 Re3+ Kf8 Rg3 Ke8 Rg2 Kf8 Rc2 Kg8 Rd2 Kh8 Rd1 Kh7 Re1 Kh8 Ke7 Kg7 Ra1 Kg8 Kd6 Kh8 Rc1 Kh7 Ke6 Kg7 Rg1+ Kh8 Kf5 Kh7 Kf6 Kh8 Rf1 Kg8 Rg1+ Kh7 Rh1 Kh8 Kf7 Kh7 Rxh4#
44,loss,black,stockfish_level_1,N/A,195,d4 Nc6 e4 d5 Bd3 Nxd4 Be3 dxe4 Bf1 Nf3+ gxf3 Qxd1+ Kxd1 Nf6 Nd2 Bd7 Nxe4 Nd5 Bg5 Ba4 Ne2 Bb5 Bd2 Bc4 b3 Ba6 Ke1 f5 Ng5 h6 Ne6 Kf7 N2d4 Bxf1 c4 Bg2 Rg1 c5 Rxg2 cxd4 cxd5 d3 Rc1 Kg8 Rc7 Rb8 Bc3 Rh7 Kd2 Kh8 Kxd3 Kg8 Be5 Kh8 a4 Kg8 Rg1 Kh8 a5 Kg8 Kc2 Kh8 Rg6 Kg8 Rg1 Kh8 a6 bxa6 Rd1 Ra8 Rd3 Kg8 h4 Kh8 f4 Kg8 Rg3 Kh8 b4 Kg8 Rg1 Kh8 Rc1 Kg8 f3 Kh8 h5 Kg8 Rh1 Kh8 Bd4 Kg8 Bc5 Kh8 Rc6 Rb8 Ra1 Rb5 Raxa6 Kg8 Bd4 Rxb4 Bc3 Rb7 Bd4 Rd7 Rc5 Kf7 Kd1 Kg8 Rb5 Kf7 Rc5 Kg8 Kc2 Kf7 Raa5 Kg8 Rc8 Rh8 Rxa7 Rxa7 Rxf8+ Kh7 Kc3 Ra3+ Kb4 Rxf3 Rxh8+ Kxh8 Kb5 Rb3+ Kc6 Rg3 Bc5 Rc3 Kd7 Rc4 Kxe7 Re4 Bd6 Kg8 Be5 g6 hxg6 Re3 g7 Re4 d6 Re3 Bb2 Re4 Bc1 Re2 Kf6 Re1 Ba3 Re3 Bc5 Re4 d7 Rxe6+ Kxe6 Kxg7 Bd6 Kh8 Kd5 Kg8 Ke6 Kh8 Kd5 Kg8 Bb4 Kh8 Kd6 Kg8 Bc5 Kh8 Bg1 Kg8 Ke6 Kh8 Kd6 Kg8 Ke6 Kh8 Kf6 Kg8 Kg6 Kh8 Be3 Kg8 Bd2 Kh8 d8=R#
