game_number,result,your_color,opponent_type,opponent_elo,move_count,moves
2,loss,black,stockfish_level_1,N/A,39,e4 e5 Nf3 Nf6 Nxe5 Nxe4 Qf3 Ng5 Qe2 Qe7 d4 Qb4+ c3 Qe7 Be3 Ne4 g3 Nd6 Nd2 Na6 Bg2 Qe6 O-O Be7 Rae1 Qxa2 d5 Qxb2 Bd4 O-O Nd3 Qb5 g4 Bg5 f4 Re8 Qxe8+ Nxe8 Rxe8#
1,loss,white,stockfish_level_1,N/A,98,Nf3 Nf6 Nc3 d5 Ne5 d4 Nb5 c6 Na3 e6 Nac4 b5 Na3 a6 Nb1 Bb7 Rg1 Qc7 Nf3 c5 Ng5 Qxh2 Nf3 Qd6 Ng5 Nbd7 Na3 c4 Rh1 Be7 Nxh7 Nxh7 Rb1 Ndf6 Ra1 g6 Rb1 O-O-O Ra1 Qc7 Nb1 Bc5 Rh6 Ng5 Rxh8 Rxh8 d3 Qe5 c3 Nd5 dxc4 dxc3 cxd5 Ne4 Be3 Bxe3 Qd3 Bxf2+ Kd1 Bxd5 bxc3 Bg3 Kc2 Qd6 Qd4 Rd8 Qd3 Kb8 Qd4 Qc7 Qd3 f6 Qd4 Bf2 Qd3 Ba7 Kb2 f5 Kc2 g5 Kb2 Bb7 Qf3 b4 Kc1 e5 g3 g4 Qxf5 Be3+ Kc2 Rd2+ Nxd2 Qxc3+ Kd1 Nf2+ Qxf2 Qxd2#
4,loss,black,stockfish_level_1,N/A,91,e4 d5 Bd3 e5 Nc3 dxe4 Nxe4 Qd5 Qf3 Nc6 b3 Nd4 Qg3 Nf5 Qh3 Nge7 Bb2 Nd4 Qh5 Ndc6 Ne2 Be6 Ng5 Qxg2 Rg1 Qd5 Be4 Qd7 Nxh7 Bg4 Rxg4 Rxh7 Bxh7 g6 Qh3 Nd5 Rg3 Qxh3 Rxh3 Nf6 f4 Bd6 a4 Kf8 fxe5 Bxe5 Bxe5 Nxe5 a5 Kg7 Ra4 Rh8 Rg3 Rxh7 a6 Rxh2 axb7 Nfd7 Nd4 Kh8 Rg1 Rh4 Kd1 Nb8 Re1 f6 Kc1 Kh7 d3 Nf7 Rc4 c6 Kd1 Kh6 Kc1 Nd6 Ra4 a6 Rf1 Nxb7 Nf5+ gxf5 Rxh4+ Kg5 Rh2 Nd7 Rhf2 Nd6 Rg2+ Kh6 Rh1#
6,loss,black,stockfish_level_1,N/A,75,e3 d5 c4 e5 cxd5 Qxd5 Nc3 Qc6 Bb5 Nf6 d4 exd4 exd4 Bd6 Bxc6+ Nxc6 a4 Bg4 Nge2 Bb4 Qc2 Kf8 Bd2 Be6 f3 Rg8 O-O Bc4 Rfc1 Rh8 d5 Ne5 Be3 Bd3 Qb3 a5 Nd4 Bc4 Qc2 Bc5 Rd1 Kg8 b3 Ba6 Bf2 Ra7 Kh1 Bb6 h3 Bc5 d6 cxd6 Be3 Bb6 h4 Bc5 Rab1 Bb6 Rb2 Bc5 Ncb5 Bxb5 b4 Bd3 Qc1 axb4 Rb3 Bc4 f4 Bxb3 Nxb3 Bxe3 Qc8+ Ne8 Qxe8#
7,loss,white,stockfish_level_1,N/A,130,Nc3 d5 d4 Bf5 Nf3 c6 Bg5 Bg6 Ne5 Nf6 Nxg6 hxg6 Qd3 Qd6 O-O-O Ng4 Qf3 f5 Bf4 Qd7 Bxb8 Rxb8 Qf4 Rc8 Rd2 Rh5 Qf3 e6 Kb1 Nxh2 Qf4 Bd6 Qe3 Kf7 Ka1 f4 Qd3 Qe7 Rd1 Qg5 Rd2 Rch8 Rd1 Be7 Rd2 Qf6 Rd1 Ng4 Nxd5 exd5 Rxh5 Rxh5 Qf3 Nh6 Rd2 Kf8 Rd3 Ke8 Re3 a6 Rxe7+ Qxe7 Qxf4 Qd7 Qe3+ Kf8 Qf3+ Kg8 Kb1 b5 Ka1 Rf5 Qh3 Qd8 f3 Qe8 Kb1 Rf7 Ka1 g5 Qh5 g4 Qg6 Rf8 Qd6 Nf5 Qf4 Nh6 Qd6 a5 Kb1 b4 Ka1 a4 Kb1 Nf7 Qc5 g6 fxg4 Qe4 Qxb4 Re8 Qxa4 Re6 Qa8+ Kg7 Qa7 Kf6 Qd7 Rd6 g5+ Kg7 Qc7 Qe8 Ka1 Re6 Qb7 Re3 Qc7 Re4 Qa7 Qe7 Qb6 Nxg5 Qxc6 Qf7 Qc3 Qxf1+ Qe1 Qxe1#
9,win,white,stockfish_level_1,N/A,99,Nf3 e6 Nc3 Be7 Ne5 Bd6 Nc4 Be7 Ne5 d6 Nc4 a6 Rg1 b5 Ne3 Nf6 Rh1 Bb7 Rg1 b4 Na4 Nc6 Nc4 d5 Ne3 e5 Nf5 Bf8 Rh1 g6 Ne3 Bd6 Rg1 h5 Rh1 h4 Rg1 e4 Rh1 h3 gxh3 Kf8 Bg2 Rh5 Kf1 d4 Nc4 Rf5 Kg1 Ne5 Nxe5 d3 Nc4 e3 Nxd6 exf2+ Kf1 dxc2 Qxc2 Bxg2+ Kxg2 cxd6 Nc5 Rg5+ Kxf2 Rxc5 Qd3 Nh5 Qd4 Re5 Ke1 Kg8 Rf1 Qe8 Qc4 Qe7 Rxf7 Qxf7 Qc6 Rf8 Qg2 g5 d4 Ra5 Bxg5 Kh8 Bd2 Qf6 Bxb4 Rf5 Qg1 Rg8 Qe3 Rf4 Bxd6 Qh4+ Kd2 Re4 Qh6#
3,loss,white,stockfish_level_1,N/A,430,Nc3 d5 Nf3 e6 Ne5 a6 Rg1 c5 Rh1 f6 Nd3 Nc6 Nf4 d4 Ne4 f5 Ng3 e5 Nd3 c4 Nxf5 Bxf5 e4 dxe3 Qh5+ g6 Qf3 e4 Qf4 h5 fxe3 Rh7 Nf2 Nb4 Qe5+ Re7 Qc3 Nd5 Qa3 Rh7 Qa4+ b5 Bxc4 bxa4 Ke2 Nb6 Bxg8 Rb8 Bxh7 Qe7 Bg8 Qc7 Kd1 a5 Rb1 Bd6 Ra1 Nc8 Bd5 Ne7 Bxe4 Kf7 Rg1 Be5 Nd3 Bxh2 Rf1 Ke8 Bxf5 gxf5 Rf3 Rb6 Rf2 h4 Rf3 Rg6 Rf2 Bd6 Rb1 Qb7 Ke2 Qa6 Kf1 a3 bxa3 Re6 Bb2 Bg3 Rf3 Rb6 Kg1 Qc4 Kh1 Qxc2 Rg1 a4 Bd4 Rc6 Nb4 Qc4 Nxc6 Qxc6 Rgf1 Qc4 Bf6 Bb8 Rb1 Bg3 Bxe7 Kxe7 Rb7+ Kf6 Rb6+ Kg5 Rb1 Qd3 Rb2 Qxa3 Rc2 Qd6 Rb2 a3 Rb5 Kg6 Rbxf5 Qd8 Rf6+ Qxf6 Rxf6+ Kxf6 Kg1 Be1 d3 Ke5 d4+ Ke4 Kf1 Ba5 Kf2 Kd3 Kf3 Bd8 Kf4 Kc3 Kf5 Kb2 Kg6 Ba5 Kh5 h3 gxh3 Bb6 Kh6 Bc7 Kh7 Bd8 Kh8 Bf6+ Kh7 Be7 Kh8 Bf6+ Kh7 Be7 Kh8 Kxa2 Kh7 Kb2 Kh8 Kb1 Kh7 a2 Kh8 Bb4 Kh7 Bd6 Kh8 Ba3 Kh7 Bb2 Kh8 Bc1 Kh7 Bxe3 Kh8 Bxd4+ Kh7 Kc2 Kg8 Bc3 Kf8 Bd4 Kf7 Be5 Kf8 Bc3 Kf7 Kb2 Kf8 Kc2 Kf7 Kb2 Kf8 Ba5 Kg7 Kc2 Kh8 Bc7 Kh7 Bh2 Kh8 Bf4 Kh7 Bh2 Kh8 Bg1 Kh7 Bd4 Kg8 Bf6 Kf8 Kb1 Kf7 Bc3 Kf8 Bb2 Kf7 Ba3 Kg7 Bb4 Kh8 Ba3 Kh7 Bc1 Kh8 Ba3 Kh7 Kc2 Kh8 Bc1 Kh7 Kb2 Kh8 Kb1 Kh7 Ba3 Kh8 Bc5 Kh7 Ba3 Kh8 Bb2+ Kh7 a1=Q Kg8 Qa5 Kh7 Qa4 Kg8 Qa6 Kh7 Qa4 Kg8 Qf4 Kh7 Qg3 Kh6 Qe1 Kh7 Qg3 Kh6 Qf3 h4 Qf1 Kg6 Qf4 h5 Qe5 h6 Qb5 Kf7 Qd5+ Kf8 Kc1 h7 Kd2 Ke8 Qf5 Kd8 Bf6+ Kc7 Qd3 h8=Q Qg3+ Kc8 Bxh8 Kb7 Qg7+ Ka8 Ke3 Kb8 Qb2+ Ka8 Qa1+ Kb8 Qb2+ Ka8 Qe2 Kb8 Be5+ Kb7 Qb2+ Ka7 Qa1+ Kb7 Qb2+ Ka7 Qa3+ Kb7 Qb3+ Ka7 Qa3+ Kb7 Qe7+ Ka8 Qd8+ Kb7 Qd7+ Ka8 Qa4+ Kb7 Kf3 Kc8 Qa6+ Kd8 Qd3+ Kc8 Qf5+ Kb7 Qb1+ Ka6 Qf1+ Kb7 Bd6 Kc6 Qd3 Kb7 Qh7+ Ka8 Qh4 Kb7 Bc5 Kc8 Qg4+ Kc7 Qf4+ Kc6 Qd4 Kc7 Qd6+ Kc8 Ba7 Kb7 Qe7+ Ka8 Qe6 Kxa7 Qf5 Ka8 Ke2 Kb7 Qf2 Ka8 Qf3+ Ka7 Ke3 Kb8 Qf4+ Kc8 Qf1 Kb7 Kf3 Kc8 Kg3 Kc7 Kg2 Kb7 Kf3 Kc8 Ke4 Kb7 Qh3 Ka8 Ke5 Kb7 Qf3+ Kc7 Qf6 Kb7 Qf3+ Kc7 Kd5 Kb7 Qf8 Kc7 Qf7+ Kc8 Kc5 Kb8 Qe7 Ka8 Kb5 Kb8 Qc5 Ka8 Qc4 Kb7 Qc3 Ka8 Ka6 Kb8 Kb5 Ka8 Qe3 Kb7 Qd4 Ka8 Ka6 Kb8 Qd8#
8,loss,black,stockfish_level_1,N/A,207,e4 Nf6 e5 Nc6 exf6 exf6 Nc3 Qe7+ Be2 Nd4 d3 Qc5 Rb1 Bd6 Kf1 Kf8 Nf3 Nxf3 gxf3 Qe5 d4 Qf5 h4 Bb4 Qd3 Qxd3 Bxd3 c5 Nd5 Rg8 a4 Rh8 Bf4 Kg8 Be4 f5 Bd3 Kf8 Kg2 Kg8 Bg3 f4 Nxf4 cxd4 h5 Bd6 Rhe1 Kf8 h6 gxh6 Ne2 Rg8 Kh2 Bb4 Red1 b5 Nxd4 Bc5 Be4 Bxd4 Bxa8 Bxb2 Be4 bxa4 Rxb2 Rg7 Bd5 Kg8 Rbb1 Rg5 c4 Rh5+ Bh4 Rxh4+ Kg2 Rf4 Ra1 Rf5 Rg1 Rg5+ Kf1 Rxg1+ Kxg1 Ba6 Rxa4 Bc8 c5 a6 Ra1 Kf8 f4 Kg8 Re1 Kf8 f5 Kg7 Re3 Kf6 Re8 Kxf5 Bh1 d6 Rxc8 dxc5 Ra8 Kg4 Re8 Kh4 Re4+ Kh5 Re3 Kg5 Re8 Kg4 Re7 Kh4 Re4+ Kh5 Re5+ Kh4 Bc6 c4 Re3 Kg5 Bg2 Kg4 Bf1 c3 f3+ Kh4 Bc4 c2 Re1 Kg3 Rc1 Kxf3 Kf1 Kg3 Ke2 Kh3 Ba2 f6 Kf2 Kh2 Bd5 Kh3 Bf3 Kh4 Bg2 Kh5 Be4 Kh4 Rxc2 Kh3 Bf5+ Kh2 Ra2 Kh1 Be4+ Kh2 Bf3 Kh3 Bc6 a5 Ke1 Kg3 Ra4 Kh2 Kf1 Kh3 Ke1 Kh2 Rxa5 Kg1 Ra7 Kh2 Rd7 Kg1 Rg7+ Kh2 Rb7 Kg1 Rg7+ Kh2 Kf2 Kh3 Bg2+ Kh2 Bf1 Kh1 Be2 Kh2 Bf3 Kh3 Bh1 Kh2 Bd5 Kh3 Re7 Kh2 Bc6 Kh3 Bd7+ Kh2 Rxh7 Kh1 Rxh6#
5,draw,white,stockfish_level_1,N/A,468,e4 e6 d4 b6 Bc4 Nf6 Nc3 d5 exd5 Bb7 Bg5 Be7 dxe6 Kf8 exf7 Bxg2 Bxf6 Bxf6 Bd5 Bxd5 Nxd5 Qxd5 Qf3 Qe6+ Ne2 c6 Qf4 Nd7 d5 Qxd5 Qb4+ c5 Nf4 Qc6 Ng6+ Kxf7 Nxh8+ Kg8 Qc4+ Kxh8 O-O-O Ne5 Qf4 Ng6 Qf5 Re8 b3 Rf8 Rhg1 c4 bxc4 Be7 Rxg6 Ba3+ Kb1 Qa4 Qd7 Qxd7 Rxd7 hxg6 Rxa7 Bd6 Rd7 Bxh2 Re7 g5 Ka1 Kg8 f3 Rxf3 Kb2 Rf8 Re6 Bc7 Re7 Bh2 Re6 Bf4 Rxb6 Ra8 Rb5 Rc8 Kc3 Kh7 Rf5 Re8 Kb4 Kg6 Rd5 Rb8+ Kc5 Kh6 Kc6 Rf8 Kb6 g4 Rd7 Rb8+ Ka7 Rh8 Re7 g6 Re2 Rc8 Rf2 Rxc4 Ka8 Be5 Kb7 Rc7+ Ka8 g3 Rg2 Rc3 Kb7 Bd6 Kb6 Bb8 Kb7 Bc7 a3 Bd6 a4 Bc7 Ka8 Bf4 Kb7 Be5 Ka8 Bd4 Kb7 Bf2 Kb8 Ra3 a5 Ra4 c3 g5 a6 Ra3 Kb7 Kh5 Kb8 Kg4 Kb7 Rb3+ Ka8 Ra3 Kb8 Kh3 a7 Rb3+ Kc8 Bxa7 Rc2 g4 Kd8 Rb6 Ke8 Rf6 Ke7 Rf1 Kd8 Bb8 Kc8 g2 Rxg2 Rf8+ Kb7 Be5 Rc2 Rf5 Ka8 Bf6 Kb8 g3 Ka8 Rf2 Rxf2 gxf2 Kb7 Bh8 Kc8 Kg3 Kc7 Kf4 Kc8 Ke3 Kc7 Bg7 Kc8 Bh6 Kc7 Bf8 Kc8 Bh6 Kc7 Bf8 Kc8 Ke4 Kc7 Bg7 Kc8 Ke3 Kc7 Ke4 Kc8 Ke3 Kc7 Bf6 Kc8 Bh4 Kc7 Be7 Kd7 Bg5 Kc8 Bf4 Kb7 Ke4 Kc8 Bh2 Kb7 Bd6 Kc6 Be7 Kd7 Bc5 Kc6 Be7 Kd7 Bc5 Kc6 Be3 Kc7 Bh6 Kc8 Bc1 Kc7 Kf3 Kc8 Bd2 Kc7 Bf4+ Kc8 Bd2 Kc7 Ke2 Kc8 Bxc3 Kc7 Bg7 Kc8 Bh8 Kc7 Bc3 Kc8 Bb4 Kc7 f1=Q Kc8 Qf5+ Kc7 Qh7+ Kb8 Qh2+ Kc8 Qh8+ Kc7 Qg7+ Kb8 Qh8+ Kc7 Qc3+ Kb8 Bc5 Ka8 Qh8+ Kb7 Qh1+ Kc7 Qh6 Kb8 Qh8+ Kc7 Qh7+ Kc8 Qh8+ Kc7 Qe5+ Kb7 Qg7+ Kb8 Qg3+ Ka8 Qg2+ Kb8 Qh2+ Kc8 Kf3 Kb7 Qh4 Kc8 Qg4+ Kc7 Qg7+ Kc8 Qh8+ Kc7 Qh2+ Kc6 Be3 Kb7 Qh4 Kc8 Qh3+ Kc7 Qh7+ Kc8 Qh3+ Kc7 Qh2+ Kc8 Ke4 Kb7 Bc5 Kc6 Qh3 Kxc5 Kf5 Kb6 Qh2 Kb7 Ke4 Ka8 Qa2+ Kb7 Qd2 Ka8 Kf4 Kb7 Kf5 Ka8 Qc3 Kb7 Ke4 Ka8 Qh8+ Kb7 Qh3 Ka8 Ke5 Kb7 Kf5 Kb8 Qh2+ Ka8 Qg2+ Ka7 Qg1+ Ka8 Qf2 Kb7 Qg1 Ka8 Qf2 Kb7 Qh4 Kb8 Qh8+ Kb7 Qh2 Ka8 Qd6 Kb7 Qd1 Kb8 Qb1+ Ka8 Ke6 Ka7 Qa1+ Kb7 Qa4 Kb8 Kd7 Kb7 Qa2 Kb8 Qg8+ Kb7 Qe8 Kb6 Qd8+ Kb7 Qf8 Ka7 Kc8 Kb6 Qf2+ Ka6 Qf4 Ka7 Kd7 Kb7 Qf8 Ka7 Kc7 Ka6 Qf4 Kb5 Qh4 Ka5 Kc8 Ka6 Kb8 Kb5 Qh6 Kb4 Qh1 Kb5 Qh6 Kb4 Qh1 Kb5 Qa1 Kb6 Qa8 Kb5 Qa3 Kc6 Qa4+ Kd6 Qb4+ Kd7 Qa4+ Kd8 Qa5+ Ke8 Qe5+ Kf7 Qh5+ Kg7 Qg5+ Kh8 Qf6+ Kg8 Qd8+ Kg7 Qc7+ Kh8 Qc8+ Kg7 Qd7+ Kh8 Qc8+ Kg7 Qd7+ Kh8 Qc8+ Kg7 Qd7+ Kh8 Qc8+ Kg7 Qd7+ Kh8 Qc8+
13,loss,white,stockfish_level_1,N/A,50,e4 e5 Nc3 Nf6 Qf3 Bc5 Nge2 O-O Qf5 d5 Qxe5 Nc6 Qg5 h6 Qh4 Nb4 Kd1 Ng4 Qg3 Nxf2+ Qxf2 Bxf2 exd5 Bd7 Ne4 Bb6 Nf4 Kh8 Bc4 Bd4 Re1 b6 Re2 Bg4 Bd3 Re8 Ke1 Nxd3+ Nxd3 Qxd5 Nf4 Qb7 Nd6 cxd6 Ng6+ fxg6 Rxe8+ Rxe8+ Kf1 Qf7#
12,loss,black,stockfish_level_1,N/A,113,e3 d5 Nf3 Nf6 d4 Nc6 b3 Bg4 Bb2 Qd6 Nc3 Qb4 a3 Bxf3 Qxf3 Nxd4 Qd1 Nxc2+ Qxc2 Qc5 Rc1 Ne4 Qd3 Nxc3 Rxc3 Qa5 Qd2 d4 Rd3 Qa6 Be2 Rd8 exd4 Rd7 h4 Rg8 Rdh3 Qe6 Re3 Qh6 Qc1 Qf4 g3 Qh6 O-O Rh8 Qc2 Qf6 b4 Kd8 Re5 Kc8 Rc1 Rg8 b5 Rh8 d5 Rg8 Bg4 e6 Rg5 Qh6 Rh5 Qg6 Qd1 Bd6 Rg5 Qh6 a4 Kb8 dxe6 fxe6 Qe1 Ka8 Rc4 Rh8 Be2 Ba3 Bxa3 Qf6 Re4 Rg8 a5 Rh8 Rge5 Rg8 Re3 Rh8 Bc4 Rd4 Be2 Ra4 Bb2 Ra2 Bd4 Ra4 Ba1 Ra2 h5 Rg8 Bf1 Rxf2 Bc3 Rxf1+ Qxf1 Qh6 Kg2 Rh8 Rf3 Rg8 Rf8+ Rxf8 Qxf8#
14,loss,black,stockfish_level_1,N/A,59,e4 Nc6 d4 Nf6 Bd3 Nxd4 c3 Nc6 Nf3 Ng4 a4 Rg8 Be2 Rh8 h3 Nf6 e5 Ne4 Bd3 Nc5 Bc2 Rb8 O-O Ra8 b4 Ne6 Be3 Rb8 Na3 Ra8 Nc4 Rb8 Qd3 Ra8 a5 Rb8 b5 d5 exd6 Nxa5 Rxa5 Ra8 d7+ Bxd7 Nce5 b6 Raa1 Qc8 Rfd1 Qd8 c4 Bxb5 Qf5 Qxd1+ Rxd1 f6 Qg6+ hxg6 Bxg6#
15,loss,white,stockfish_level_1,N/A,120,d4 Nf6 Nc3 d5 Bg5 e6 Nf3 c5 dxc5 Nbd7 c6 Nc5 cxb7 Bxb7 Ne5 d4 Qd2 dxc3 Qxd8+ Rxd8 bxc3 Rb8 Rb1 Nfe4 Be3 Be7 Bxc5 Nxc5 Rb5 Rc8 Rg1 Ba8 Ra5 a6 Nxf7 Rf8 Ne5 Rb8 Ra3 Rf5 Ra5 Ne4 e3 Bf6 Rxa6 Rb1+ Ke2 Nxc3+ Kd3 Ke7 Ra7+ Rb7 Nc6+ Kd6 Ne7 Kxe7 Rxa8 Rxf2 Rh8 Rd7+ Kc4 Ne4 Bd3 Nd2+ Kb5 Kd6 Rxh7 Rc7 Kb6 Rc3 Kb7 e5 Kb8 e4 Rd1 exd3 cxd3 Rc2 Rh5 Be5 Rxe5 Kxe5 d4+ Kf5 g4+ Kg6 Kb7 Rxh2 Kb8 Re2 Kb7 Kg5 Kb8 Nf3 Rf1 Kxg4 Kb7 Rb2+ Kc8 g5 Kd8 Rxe3 d5 Rd3 Ke8 Rb7 Kf8 Rd7 Kg8 Rd2 Kh8 Ra7 Kg8 Rb7 Kh8 Rxd5 Rxf3 Rd8+ Rf8 Rxf8#
11,draw,white,stockfish_level_1,N/A,325,e4 d5 Nf3 dxe4 Bb5+ Nc6 Ne5 Qd6 Nc4 Qh6 Nc3 a6 d3 Qg6 Ne5 Qe6 Bxc6+ bxc6 d4 f6 Qh5+ g6 Nxg6 hxg6 Qxh8 Qg4 Qxg8 Be6 Qh8 Qxg2 Rf1 Bh3 Kd2 Qxf1 Nxe4 c5 d5 O-O-O d6 Bf5 Qh4 Bxe4 Qg4+ Kb8 Qxe4 Qxf2+ Kc3 Qd4+ Qxd4 cxd4+ Kxd4 Rxd6+ Kc5 e5 Be3 Rd1+ Kc6 Rxa1 Bc5 Kc8 Bxf8 g5 Bg7 Rh1 Bxf6 Rxh2 Bxe5 Rxc2+ Kd5 Kd7 Ke4 Rd2 Ke3 Rg2 Kf3 Rg1 Kf2 Rc1 Kg3 a5 Kg4 Re1 Kf5 Re2 Kf6 a4 Kf5 g4 Kf4 Kc6 Kf5 Kd7 Kf4 Kc6 Kf5 g3 Bxg3 Kd7 Be5 Kc6 Kf6 Kd5 Bxc7 Rxb2 a3 Rf2+ Kg7 Rb2 Kg8 Rb3 Bd8 Re3 Bc7 Ke6 Bd8 Kd7 Bf6 Rxa3 Bh8 Re3 Bf6 Rg3+ Kh8 Rh3+ Kg8 Rb3 Kh8 Rb7 Kg8 Kc7 Be5+ Kc6 Kh8 Rb1 Kg8 Kd7 Kh8 Kc8 Kg8 a3 Kh8 Rc1 Bd6 a2 Be5 Rh1+ Kg8 Kd7 Kg7 Rf1 Kh8 Rb1 Kg8 Kc6 Kh8 Kd7 Kg8 Rg1+ Kh8 Rg6 Kh7 Rg4 Bg7 Rh4+ Kg8 Rh2 Bh8 Kc6 Bf6 Re2 Kh8 Kd6 Kg8 Rh2 Bh8 Kc6 Bf6 Re2 Kh8 Kc5 Kg8 Kb4 Kh8 Kb3 Kg8 Rf2 Bd4 Rd2 Bg7 Rg2 Kh8 Rxg7 Kxg7 Kc2 Kh8 Kc3 Kh7 Kb2 Kh8 Kc2 Kh7 Kd2 Kh8 Kd1 Kh7 Ke2 Kh8 Ke3 Kh7 Kd3 Kh8 Ke3 Kh7 Kf2 Kh8 Ke1 Kh7 Kf2 Kh8 Kg1 Kh7 Kh1 Kh8 a1=R Kh7 Rd1 Kh8 Rc1 Kh7 Rb1 Kh8 Ra1 Kh7 Ra2 Kh8 Rb2 Kh7 Rb1 Kh8 Rb3 Kh7 Rb2 Kh8 Rh2+ Kg7 Rd2 Kh8 Rd1 Kh7 Rd2 Kh8 Kg1 Kh7 Rd3 Kh8 Rd2 Kh7 Rd6 Kh8 Kf1 Kh7 Rd8 Kg7 Rd2 Kh8 Rd4 Kh7 Rd6 Kh8 Rd3 Kh7 Rh3+ Kg7 Rf3 Kh8 Rf4 Kh7 Rh4+ Kg7 Ra4 Kh8 Ra8+ Kh7 Ra3 Kh8 Rf3 Kh7 Kg2 Kh8 Kf1 Kh7 Rf4 Kh8 Ke1 Kh7 Ra4 Kh8 Rb4 Kh7 Rb1 Kh8 Rb6 Kh7 Rb3 Kh8 Rf3 Kh7 Kf1 Kh8 Rf4 Kh7 Rg4 Kh8 Kg1 Kh7 Re4 Kh8 Kh1 Kh7 Rc4 Kh8 Rc6 Kh7 Rh6+ Kxh6
17,loss,white,stockfish_level_1,N/A,52,Nc3 c6 Nf3 d6 Ng5 Nf6 Rg1 Qb6 Rh1 e5 Rg1 d5 Rh1 Ng4 e3 Qd8 Nxh7 Be7 Bd3 e4 Nxe4 Na6 Bxa6 Rxh7 Bxb7 Ne5 Bxa8 Rh4 Nc3 Ba6 g3 Rb4 a3 Rb6 Na4 Rb3 Bxc6+ Nxc6 cxb3 Ne5 Nc3 d4 Qh5 Qd6 Qh8+ Kd7 Qxg7 Qe6 exd4 Nf3+ Kd1 Qxb3#
16,loss,black,stockfish_level_1,N/A,171,c4 Nc6 d4 Nf6 d5 Ne5 Qc2 Nfg4 e4 Rg8 Nc3 Rh8 f3 Nf6 f4 Ng6 Nf3 Rg8 f5 Nh8 Be3 Ng4 Bf4 Nf6 c5 Rb8 e5 Ng4 h3 Nh6 Bc4 Ra8 O-O Rb8 g4 Ra8 Rad1 Rb8 a3 Ra8 Ne4 Rb8 b4 Ra8 Rfe1 Rb8 b5 Ra8 b6 cxb6 Nd6+ exd6 cxd6 b5 Bxb5 Qb6+ Nd4 Qa5 f6 Nxg4 hxg4 Kd8 Bd2 Qb6 Bg5 Ke8 a4 Ng6 Kf1 Qa5 e6 Bxd6 Nf5 Kf8 exd7 Bxd7 Nxd6 Bxb5+ axb5 gxf6 Bc1 Nf4 Qe4 Nxd5 Rxd5 Rxg4 Qxg4 Qxe1+ Kxe1 Rd8 Qg2 Rd7 Kd1 Ke7 Qe4+ Kf8 Qg2 Ke7 Nf5+ Kd8 Nd4 Rxd5 Qxd5+ Ke8 Qe4+ Kf8 Qd3 Kg8 Qd2 Kg7 Nf5+ Kg6 Qh6+ Kxf5 Ba3 Kg4 Qxf6 a6 Bc5 axb5 Bb4 Kh3 Qe5 Kg2 Qg7+ Kh2 Bc3 b4 Bd2 Kh1 Be3 Kh2 Ke1 b3 Qxf7 b2 Qf2+ Kh3 Qxb2 Kg3 Qb3 Kf3 Bd4+ Ke4 Bb2 Kf4 Qb4+ Kg3 Qd6+ Kg2 Qd2+ Kg1 Bc3 b6 Qf4 Kg2 Qd2+ Kg1 Qf4 Kg2 Qf1+ Kg3 Qe2 Kh3 Qd3+ Kh2 Kf2 h6 Qe2 Kh3 Qh5#
18,loss,black,stockfish_level_1,N/A,75,e4 d5 e5 Nf6 exf6 gxf6 a4 Qd7 d3 Qc6 Be2 Qe6 Nf3 Nc6 c3 Bg7 d4 Kf8 O-O Qg4 Na3 Be6 a5 Nxa5 h3 Qe4 Bd3 Nb3 Bxe4 dxe4 Nd2 Nxa1 d5 Bxd5 Qe2 Bh6 c4 Be6 Nb3 Bxc1 Nd4 Rd8 Nab5 Bxb2 Qxb2 Bxc4 Re1 Rg8 Rxa1 Rg7 Nxc7 Rd7 g3 Rxc7 Kh2 Rd7 Rxa7 Rd8 Qb6 Ke8 Ra1 e3 Qb2 exf2 Qxf2 Kf8 Qe3 Rg5 h4 Rg7 Nf5 Rd3 Ra8+ Rd8 Rxd8#
19,loss,white,stockfish_level_1,N/A,92,Nc3 d5 Nf3 Nc6 Ng5 Nf6 Rg1 a6 Rh1 d4 Na4 e5 Rg1 Be7 Rh1 h6 Nf3 b5 Nb6 cxb6 Rg1 O-O Rh1 Ra7 Rg1 a5 Rh1 a4 Rg1 h5 Ng5 h4 Rh1 Bf5 Rg1 e4 Rh1 Nb4 Rg1 Qc7 Rh1 Nfd5 d3 e3 Ne4 Rd8 fxe3 dxe3 Rb1 Bg6 Ra1 a3 bxa3 f5 Bxe3 Bf7 Bxb6 Nxd3+ Qxd3 Qxb6 Nd2 Bf6 Rd1 Re7 Qxf5 Bc3 Qf3 Ne3 Rc1 Bc4 Kf2 Bxa2 Qf4 b4 Kf3 Rf8 Qxf8+ Kxf8 Ne4 Bb1 Rxb1 g5 axb4 g4+ Kf4 Qd4 Kg5 Qxe4 Rb3 Bf6+ Kxf6 Qf5#
10,draw,black,stockfish_level_1,N/A,548,c4 e5 d3 Nc6 Nf3 Bb4+ Nbd2 Nf6 g3 Kf8 h3 Qe7 Rb1 Qe6 a3 Ba5 e4 Rg8 b4 Bb6 c5 Qa2 cxb6 cxb6 Bg2 Rh8 b5 Ne7 Qb3 Qxb3 Nxb3 Ng6 Bd2 Kg8 a4 Rb8 h4 Ng4 Bb4 Ra8 O-O Rb8 Nbd2 Ra8 h5 Nf8 Nc4 Ne6 Nfxe5 Nf6 g4 Nf4 Bf3 Rb8 Bd6 Ra8 Kh1 Ne6 Rfe1 Nd4 Bg2 Ne6 Bf1 Nd4 f4 Ne6 Rb3 Nxf4 Ne3 Ne6 N5c4 Nd4 Rb2 Nf3 Rc1 Nd4 h6 gxh6 Rf2 Nb3 Rb1 Ne8 Ba3 Nd4 Bb2 d5 Nd2 Bxg4 Nxd5 Be6 Rg2+ Ng7 Rc1 Bxd5 Rxg7+ Kxg7 Bxd4+ Kg6 Be2 Be6 Nf3 Rhg8 Ne5+ Kg5 Rf1 Rgd8 Be3+ Kh4 Kh2 Rd6 a5 bxa5 Rg1 Bg4 Bf2+ Kg5 Be3+ Kf6 Nxg4+ Ke6 d4 Ke7 e5 Rg6 Bd3 Rgg8 Bxh6 Rae8 Bf4 h5 Ne3 Rxg1 Kxg1 Kf8 Bc4 Kg8 Kg2 Rd8 d5 Kh8 d6 Rd7 Kf1 h4 Ke2 h3 e6 fxe6 Bh2 Kh7 Kd2 Kh8 Be5+ Kh7 Bxe6 h2 Bxh2 Rd8 d7 Kg6 Kc1 Kf6 Bg4 Kg5 Bg3 a4 Bc7 Rh8 d8=B+ Kg6 Kb1 Re8 Nc2 a6 Kc1 axb5 Bb6 Re4 Bd7 Rc4 Be8+ Kh7 Kd1 Rc8 Bxb5 Kg8 Bdc7 a3 Bd7 a2 Na1 Rf8 Kd2 Kh7 Bh3 Rf6 Bd4 Rf7 Bg3 Rf3 Bdf2 Kh6 Be6 Kh7 Bh3 Kh6 Bd7 Kh7 Be8 Kh6 Be3+ Kh7 Bef4 Kg8 Bb5 Kh7 Bd6 Rb3 Nxb3 Kg8 Ke2 Kh8 Bgf4 Kg8 Bc1 Kh8 Bg3 Kg8 Bcf4 Kh8 Bh4 Kg8 Na1 Kg7 Bc4 Kh8 Kf1 Kh7 Kg2 Kh8 Bf7 Kh7 Bfg3 Kh8 Bb3 Kh7 Bf4 Kh8 Bd8 Kh7 Bdc7 Kh8 Bg5 Kh7 Bgd8 Kh8 Bg3 Kh7 Bd5 b5 Bc6 b4 Bf3 b3 Be5 Kh6 Bf4+ Kh7 Nxb3 Kg8 Bdc7 Kh7 Bcd6 Kh8 Na1 Kg8 Bd5+ Kh8 Bc4 Kh7 Bb3 Kh8 Be7 Kh7 Bc4 Kh8 Kh2 Kh7 Beg5 Kh8 Bd5 Kh7 Bc4 Kh8 Bd5 Kh7 Be3 Kh8 Bgf4 Kh7 Bc1 Kh8 Bfd2 Kh7 Nc2 a1=Q Nxa1 Kh8 Kg1 Kh7 Bh1 Kh8 Nb3 Kg8 Nd4 Kh7 Nb3 Kg8 Nd4 Kh7 Ne6 Kg8 Be1 Kh7 Bg3 Kg8 Bd5 Kh8 Bb2+ Kg8 Bb8 Kh7 Bh1 Kh6 Nc5 Kh5 B2e5 Kg4 Bed6 Kh5 Ba8 Kg4 Bf4 Kh5 Kf2 Kg4 Ke1 Kh5 Nd3 Kg4 Nc5 Kh5 Bb7 Kh4 Kf2 Kg4 Bbd6 Kh3 Be3 Kg4 Bc7 Kh4 Kf3 Kh3 Ke4 Kg2 Bef4 Kf2 Kd5 Kg2 Kc4+ Kf2 Bc6 Ke2 Bh2 Kf2 Bhe5 Ke2 Bb5 Kf2 Bd7 Kg2 Bc6+ Kf2 Ne4+ Kg2 Nc5+ Kf2 Ba4 Kg2 Be8 Kf2 Bf7 Kg2 Bcd6 Kf2 Nd3+ Kg2 Bd5+ Kg1 Bb4 Kf1 Bc6 Ke2 Bc7 Ke3 Bc5+ Ke2 B5d6 Ke3 Be5 Ke2 Nf4+ Kf2 Bb6+ Ke1 Bec7 Kd2 Ne6 Kc2 Be4+ Kb2 Nd8 Ka3 Bc2 Kb2 Kd4 Kxc2 Bd6 Kb2 Ne6 Kc2 Ke5 Kb2 Bb8 Kc2 Bd6 Kb2 Bb8 Kc2 Bd8 Kb2 Bdc7 Kc2 Kd4 Kb2 Nd8 Kc2 Nc6 Kb2 Be5 Kc2 Nb4+ Kb2 Kc4+ Kc1 Kd3 Kd1 Bbc7 Kc1 Na2+ Kb1 Nc3+ Kb2 Ne2+ Kb3 Kd2 Ka3 Nc3 Kb2 Bcd6 Ka1 Kd3 Kb2 Ne4+ Kb3 Kd2 Ka2 Ke1 Kb3 Bf6 Kc2 Bde7 Kc1 Nc5 Kc2 Bf8 Kc1 Bd6 Kc2 Bde5 Kc1 Nd7 Kc2 Nc5 Kc1 Nd7 Kc2 Nb8 Kc1 Na6 Kc2 Nc7 Kc1 Na6 Kc2 Nb4+ Kc1 Bg7 Kb1 Bgf6 Kc1 Na2+ Kc2 Bb8 Kb3 Nc3 Ka3 Bh2 Kb3 Nd1 Kc2 Bhe5 Kc1 Bc3 Kc2 Bcd4 Kc1 Bd8 Kc2 Nc3 Kb3 Bc7 Ka3 Bcb6 Kb3 Bd8 Ka3 Kd2 Kb2 Bg5 Ka1 Na4+ Ka2 Bgf6 Kb3 Ba1 Kxa4
20,loss,black,stockfish_level_1,N/A,231,e3 e5 d4 d5 h4 Bb4+ c3 Bd6 dxe5 Bxe5 Nf3 Bg4 e4 Nc6 Qxd5 Bxc3+ Nxc3 Bxf3 Qxd8+ Kxd8 gxf3 Nf6 Be3 Ke8 Rd1 Rg8 a4 Rh8 Rd2 Rg8 f4 Ng4 Bb5 Nxe3 fxe3 Kf8 Bf1 Re8 Bg2 Rh8 Rg1 Rg8 Bf1 Rh8 b3 Rg8 Rgg2 Rh8 h5 Rg8 Rd1 Rh8 Rd3 Rg8 Rdd2 Rh8 e5 Re7 e4 Rg8 Bb5 Re6 Bc4 Re8 Rg1 Rh8 Rd1 Rg8 Rg3 Rh8 h6 gxh6 Rd7 Re7 Rd5 Re8 Rd2 Re7 Kd1 Re8 Bd5 Rd8 Ne2 Ne7 b4 Rd7 Bc4 Rxd2+ Kxd2 Nc6 b5 Rg8 bxc6 Rxg3 cxb7 Rb3 Bxb3 Kg8 e6 fxe6 b8=Q+ Kg7 Bc2 Kg6 Qg8+ Kh5 Qe8+ Kg4 Qe7 Kh3 Qxe6+ Kh2 Qd5 Kg2 Qd3 Kh2 a5 Kg2 f5 Kh2 Bb1 Kg2 e5 Kh2 Bc2 Kg2 Nc3 Kh2 Bd1 Kg2 Qd5+ Kh2 Qd4 a6 Qh4+ Kg2 Ke2 h5 e6 Kg1 Qe1+ Kg2 Qh4 Kg1 Qd4+ Kh2 Qf4+ Kg2 Qg5+ Kh2 Qxh5+ Kg2 Qg4+ Kh2 Qf4+ Kg2 Qf2+ Kh1 Qf3+ Kg1 Qe3+ Kh2 Qe5+ Kg2 Qg7+ Kh2 Qxh7+ Kg2 Qf7 c6 f6 Kh3 Qg6 Kh2 Qh7+ Kg2 Qg7+ Kh2 Qh8+ Kg2 Qg7+ Kh2 Qh8+ Kg2 Qh4 Kg1 Qg4+ Kh2 Qh4+ Kg2 Qg4+ Kh2 Qf4+ Kg2 Qf3+ Kh2 Qf4+ Kg2 Qf1+ Kh2 Qg1+ Kxg1 f7 Kh2 f8=R Kg2 Rf6 Kh2 Ke1 Kg2 Bf3+ Kh2 Rf5 c5 Bh5 c4 e7 Kg2 Be2 Kh2 Rg5 Kh3 Kf1 Kh4 Rg7 Kh3 e8=N Kh2 Kf2 Kh3 Rh7#
